reviewId,content,score,thumbsUpCount,at,appVersion
09c3ca81-890e-4ff7-b4bd-d932cf7249c2,다른 은행어플도 설치되어 있는데 유독 신한은 접속이 안되네요 은행입출금 알림은 뜨지만 상세 내역 확인하려고 간편 로그인 시도하면 연결할 수 없다고 계속 나옵니다. 와이파이도 데이터에서도 다 안된다고 나온다면 어떻게 접속하라는 건가요? 다른 어플은 잘 접속되는데 이것만 접속안되는 경우가 빈번합니다. 좀 조치 좀 취해주세요.,1,0,2016-10-25 11:22:29,2.2.1
bcb0a2f1-ef7f-4b03-b0f3-73c0afa26a90,타은행 어플은 데이터가 꺼져있을때 거래가 이루어져도 켜지면 바로 밀려있던 알림이 오는데 신한은 그러지못하네요.. 심지어 데이터가 켜져있어도 알림이 오는게 제멋대로고.. 직접들어가기전까진 모른다는게 너무 불편합니다,2,1,2016-11-07 04:17:56,2.2.1
3e00a2b7-58cd-4aa3-a006-583ad92d3ccc,"보안문제 때문에 입출금확인 어렵다고 하시는데,  KB스타알림 앱은 입출금확인 잘만 되는데 이거 그럼 국민은행이 정보보안법 어긴 겁니까? 국민은행 KB스타알림앱은 잔액표시기능이 되고 신한은행은 안되는 이유를 명확히 제시해 주세요!  불편하면 공짜로 알림받는 어플 포기하고 알아서 수수료내고 SMS서비스 신청하라 이건가요?",1,18,2016-10-12 07:12:14,2.2.1
1335ca53-cb4e-45cb-97a6-a99c0d1c19e8,출금입금이라 나타내지말고 어디에썻는지는 보여줄수잇자나요? 비밀번호 치기전에 말이에요 보안때문에 그때쌓인거만볼수잇게만들어놓으면되는거고 보고나면 또 사라지니까 금액이랑 어디에썻는지 내역만이라도 좀 볼수있게 만들어주세요,2,9,2016-10-10 08:31:00,2.2.1
00cbd3e0-567e-4606-8617-1d6bd2506cce,너무 불편합니다... 지문인식도 없고 굳이 6자의 (전혀 간편하지않은) 간편 비밀번호를 입력해서 로그인을 해야 그제서야 알림 숫자를 없앨 수 있다니 뭐하러 이렇게 힘들게 만들어놨는지... 몇년째 똑같은 불편사항인데 고칠 생각은 전혀 없으신가봄.,2,37,2016-10-10 11:45:38,2.2.1
cf7dd7a9-64a0-4494-86fb-fd164fe995b6,로그인을 해야만 알림숫자가 없어지네요 업데이트 전엔 이러지 않았던 거 같은데.. 저 말고도 이 부분때문에 불편해하시는 분들 꽤 보이는데 수정 좀 해주세요,3,0,2016-10-22 01:51:38,2.2.1
488b70f5-7aa1-4987-9a19-19e9fa343b31,"타 금융 앱들은 지문인식 로그인을 확대해나가는 실정입니다만, 신한은 아직이네요. s알리미 같은 간편 조회기능들은 보안 위험도 크지않은데 지문인식 로그인적용을 빨리 했으면 합니다.",2,0,2017-01-03 04:59:11,2.2.1
b478c847-5845-43e5-a709-44e63a1da3fa,게다가 메세지 오면 폰터치가 가끔 안될 때가 있어요 입출금 메세지 보내는게 그렇게 어려운 기술인지 모르겠네 입금자 명도 안나오면서 밑에 환경설정하라고 했는데 해도 똑같이 배터리 사용량이 많고 터치도 안되고 뭐하는 겁니까? 장난하나,1,2,2016-10-22 11:13:56,2.2.1
adae54e8-642d-4b80-b61c-c8c4c9f7b242,위젯만들면 일일이 들어갈필요없이 뜨니깐 더편리하고 좋을거같은데요? 최근입출통지위젯으로 만드시면 정말편할거 같습니다 -------내용 추가드립니다 결재를 할때마다 알람이 뜨는데 알람을 눌러서 들어간것만 사라지는데 어차피 알람하나 들어가면 여태까지 거래한 내역이 전부 뜨는데 알람하나만 눌러도 나머지알람 사라지게하면 더 편리하고 좋을거 갔습니다-------,4,0,2016-10-21 10:29:36,2.2.1
9dabbfac-b62d-4200-a184-e2b75d94a45b,돈입금되면 동시에 알림 뜨나요? 아님 한곳에서 확인하면 다른 스마트폰에서는 알림이 안 뜨는지? 긍금합니다.,4,0,2016-11-17 13:01:34,2.2.1
e78b2ca8-cb34-4a51-a6f0-7361d347e493,신한은행만 이용하는데 모든계좌가 한번에 보여져서 불편하네요 계좌별로 내역을 볼수있는 기능을 만들어주면 참 좋을거같네요,5,0,2016-10-11 11:41:59,2.2.1
65aa5583-b82b-4a6e-b360-6950b541b7ae,폰을 바꾸고 설치했는데 실행하면 바로 앱닫기와 의견보내기 팝업이 뜨도 실행이안되요 os는 n 입니다.,2,0,2016-11-11 01:24:40,2.2.1
33abf063-8d6d-4d0a-a1ad-fb1bcc7b65be,어플들이 너무 많아요ㅠㅠ 신한은행어플만 제 휴대폰에 S메일 뱅크 판카드까지 3개입니다ㅠㅠ 이거 전부다 합쳐주시면안되나요?,5,1,2016-11-08 05:02:08,2.2.1
17278f2e-e10f-467d-940a-2cb0eaeb0527,다른은행 알림앱은 입출금 기록 들어가서 보기만 해도 몇개왔다는 숫자 없어지던데 꼭 로그인 해야만 숫자 없어지는게 불편하네요,3,2,2016-10-15 14:57:08,2.2.1
23d40d36-baa4-4957-8463-4fe4ffff824d,다른은행어플은 지문인식으로 확인가능한데 이것은 없어서 구지 6자리 번호입력해야되서 불편해요,1,0,2016-10-15 01:03:30,2.2.1
0a57c53d-1391-4f06-9d5b-acaf181ffaa8,자꾸 푸쉬토큰이 없다고 실행자체가안됩니다 전부삭제하고 데이터도삭제하고다시깔았는데도 같은현상이 발생하네요 해결법좀알려주세요,4,0,2016-11-07 01:28:30,2.2.1
3ae32136-f508-4eff-aef4-17769b27df8f,새롭개태어나는 신한smail 라는팝업창 뜨고 위에 액스 표시 나오는데 아무리 눌러더 안닫침니다 쓸수가 없음,1,0,2016-10-29 12:49:25,2.2.1
9bb03324-7182-4a22-83b0-f028c9f8c2c7,전자금융시스템장애라고 뜨면서 안들어가지는데 왜그런가요 JSTAR통신중 장애라고 뜨네요 해결좀해주세요,1,0,2016-10-24 13:44:02,2.2.1
a0f3b626-276f-4001-91a7-47185ff4bbcf,이거 왜 갑자기안되죠??? 앱자체가열리지를않아요ㅠㅠ,3,0,2016-10-10 10:03:30,2.2.1
3f5020bd-1f10-4947-b677-b38cc12b7887,데이터 잘 돌아가는데 네트워크 연결에 실패했습니다 C1000 이렇게 뜨네요 어떻게 해결해야 하나요,1,1,2016-10-25 10:35:09,2.2.1
121607ab-6822-4b8e-80ea-c8d9997643a1,저기..ㅋㅋ저도 평일 9시 18시까지 일해요 전화를 어떻게 해요ㅋㅋㅋ..,1,0,2016-10-15 01:37:44,2.2.1
3377e145-cfbe-43f8-928f-62adc933b8b3,V20으로 기변이후 알림이 전혀 뜨질않네요,3,0,2016-11-04 09:33:09,2.2.1
15fb103a-b043-4ef6-9f63-2c9120dc60e7,알람이왜않떠요 들어가서 확인하고있네여 ㅡㅡ,1,3,2016-10-12 02:31:17,2.2.1
94335336-4695-4720-9917-d55eca152dbe,왜 입출금통지가 되다가 안되다가 매번 재가입해야하나요,3,1,2016-10-11 06:14:47,2.2.1
4be84c36-4c6d-4c27-85a3-f6f24bb51763,업데이트 후 안들어가 집니다 정식앱이아니라고만 하는데 뭡니까?,1,0,2016-10-10 12:42:37,2.2.1
4961c98b-6b36-4ce2-ae25-9782bae28af9,결제 알림시 잔액이 표시되게 할수는 없나요?,3,0,2017-07-28 22:27:25,2.2.1
944c66b2-32fa-4002-b164-2cca4b8fba33,일반인이 항상 부당거래를 확인하고 안심할수 있어서  최고입니다.,5,0,2016-11-24 03:37:35,2.2.1
369b6b4a-307c-4388-a595-9d92291c79e6,귀찮을정도로거래내역을빠트리지않고보여주내요.,5,0,2016-10-10 13:54:10,2.2.1
e5b18f85-47ec-417c-b6fb-cea903af95c4,이거랑 신한앱하나더쓰는데 정말만족합니다,5,0,2016-11-01 06:12:01,2.2.1
eca9a52d-6100-416a-9e5c-10c6dcfe8b9e,스마일뱅크 만료일자가뜨네요   이건어떻게해결해야돼요,5,0,2016-11-02 00:59:04,2.2.1
89a34b9b-5130-4627-bdc7-51becdf063a6,리뷰보고 이전버전 Smail사용중 리뷰해주신님들고마워요,5,0,2017-01-09 13:21:50,2.2.1
77586ae2-2342-44ad-af89-0e1ca61cdc38,최신폰을 써도 버벅거리네요...,3,0,2016-11-19 14:26:42,2.2.1
7a36d78f-e6f9-42ce-a597-d54e6fbef2a9,앱이팅기고 실행 안됩니다,1,0,2016-12-28 08:18:21,2.2.1
a8e39353-5c82-4986-bdbf-c9ca637c15e9,내손 안의 폰 속 은행,1,0,2016-11-19 08:38:13,2.2.1
ee5a694e-6bcf-4f86-94f8-257cec2de956,특히 입출리포트가 잼있네요 ^^,5,0,2016-10-12 08:50:30,2.2.1
b4cbdc2e-9d7d-45b4-9c67-7523842c76da,누구나 가입할수있는거 아닌가요.,2,0,2016-10-24 12:48:34,2.2.1
93ecc905-34b7-427b-b8e3-be8ac209e10b,노트3입니다.,3,0,2016-11-21 04:21:46,2.2.1
8f3b0369-4ba6-4739-b65c-bc767d0b4aca,주거래가 신한인데  넘 넘 좋네요^^,5,0,2016-11-18 04:27:19,2.2.1
f2f9c77f-01e4-4eeb-b6ed-3bfcbab06a9b,엄~청 느려짐!,4,2,2016-10-10 10:06:37,2.2.1
0bfd8fb5-dd01-4a6b-81a7-4e2019c75221,편하게 사용할수 있어서 좋아요.,5,0,2016-10-11 02:16:14,2.2.1
a0b0b812-ce19-4d13-a93d-3ef7005d35fa,갤노트4 인데 입출금 알림이 안뜸,1,0,2016-10-20 15:30:49,2.2.1
dc4571e1-eb1f-4323-b3dc-f0e1ee15edcc,알람음이 재때 울리지 않음,1,0,2018-07-25 03:01:03,2.2.1
3ecdc628-bc12-4770-a03b-487cf08bf358,ㄴᆞㅁ편함,5,0,2016-10-21 19:48:51,2.2.1
0542f32e-40e3-4b8c-82c7-c87d99197d37,바로바로확인되니넘좋아용,5,0,2016-11-16 03:27:03,2.2.1
7e564542-624b-4601-a0fe-a0708b0a0942,바탕 화면 배치 하려고 항,5,0,2016-11-09 14:12:30,2.2.1
7309f753-55a4-4738-aa75-bdc52df49af8,입출금 통지,5,0,2016-11-17 07:05:22,2.2.1
892e56a1-1c6c-4283-97c6-91ff9e88d372,편함,5,0,2016-12-26 08:53:25,2.2.1
8c21d643-3d46-44ab-9e16-94aaabdbd23f,이게 가장좋은것 같네요,5,0,2016-11-14 15:41:11,2.2.1
7f97f0a8-7ae1-4d37-83cf-cd9cce215db3,ㅡㅡ,1,0,2016-10-25 10:41:15,2.2.1
8618315c-42e7-40f1-a160-9d288601e3f6,열리지조차않음,1,0,2016-12-27 07:52:09,2.2.1
b6980d22-1354-4c23-a290-09e02df7dfc1,계속 렉..,1,0,2016-12-26 11:19:06,2.2.1
ce8d25fa-acb6-4001-af97-0c591024d922,제목으로도찾을수있었으면좋겠습니다,5,0,2016-10-19 02:47:36,2.2.1
fac60e81-2db5-43b5-ba71-2318f03c87cb,연속되는 번호나 반복되는 번호도 비번으로 쓸수있게 해주시고요. 종료할때 확인.아니오가. 아니고 예.아니오로 해야 질문에 대한 어감이 맞습니다. 그리고 그보다는 뒤로가기 버튼 2번 누르면 자동종료가 되게 해주시면 훨씬 좋겠습니다. 또한 입금자가 누군지도 동시에 볼수있게 해야지 꼭 비번을 누르고 들어가야 확인이 된다면 매우 짜증나요. 입금자가 누군지 상세조회를 안하면 바탕화면 아이콘에 빨간색으로 숫자표시가 나던데요. 상세조회를 해야 숫자가 없어지니 매우 짜증납니다.  위 사항이 반영되지 않은 현재의 시스템은 정말이지 바쁜 세상에 엄청 짜증납니다. 스마트하지가 못해요. 현재의 프로그래은 정말 최악입니다.,1,0,2016-08-15 11:09:53,2.2.0
28f80577-5efa-4a2c-a58f-0159e82447a1,"스마트 매니저에서 이 앱때문에 스마트폰이 느려지고 있다는 경고가 옵니다. 지난 1주일동안 오류도 11번 발생했다고 하구요.. 앱 자체를 가볍게 좀 만들어 주시면 좋을 것 같은데요... 그리고 로그인 문제를 다들 많이 얘기하는데 다른 은행의 입출금 알림 앱은 반드시 로그인을 요구합니다. 그런데 이 앱은 로그인 안해도 입출금 내역이 보인다고 하지만, 잔액을 확인하기 위해선 또 로그인을 해야죠... 로그인 자체가 불편한게 아닙니다.. 로그인을 위해서 또 클릭을 하고 선택하는게 불편하죠.. 로그인을 안하면 알림뱃지도 안 없어지는데, 로그인 안하고도 내역을 확인할 수 있다는 게 과연 장점일까요? 잔액도 모르는데? 그냥 앱 실행하자마자 로그인 화면을 만들어주세요.. 이왕이면 지문이면 더 좋겠습니다.",2,13,2016-09-29 13:56:09,2.2.0
38082ce0-e44d-4289-bbe8-07ebaf1de4be,아이콘에 보여지는 알림 기능의 사용 여부가 있으면 더욱 좋을 것 같습니다. 저와 같은 생각을 하는 분들이 많이 있는 것 같은데 이런 사항은 사용자들의 선택하여 선택의 폭을 조금 더 넓혀갔으면 좋겠습니다.  그게 안된다면 로그인 하지 않고 앱 상에서 알림 숫자를 없앨 수 있게 해주셨으면 합니다. 숫자를 없애려면 반드시 로그인을 해야지만 가능한데 너무 비효율적이라고 생각합니다. 이런 불편사항을 빨리 개선 해주시길 바랍니다.,3,0,2016-09-26 13:53:34,2.2.0
f7040f1c-0e3d-4aea-a825-fcb10a9e215f,G5 사용자 이구요 한번씩 폰이 뜨거워서 프로그램 cpu 사용어플로 체크해보면 신한은행 어플이 cpu를 엄청 먹고 있습니다. 강제로 꺼주면 괜찮구요 저런 상황에선 베터리도 소모도 심합니다. 2016년9월23일 추가 - 아직도 계속 그렇습니다. 문제가 해결되지 않고있네요 갑자기 폰이 뜨거워져서 보면 이 어플이 cpu를 많이 먹고 있어서 그렇네요 그럴때는 메모리점유량도 높습니다.,3,0,2016-09-23 06:26:22,2.2.0
8014f91f-264e-4c0d-819b-0ef81b907980,입출금 내역에서 메모를 작성하면 메모가 메모함으로 바로 들어가더라구요. 근데 나중에 보려할때는 일일히 메모함이랑 입출금내역을 비교해야 해서 가독성이 떨어지는것 같아요. 메모작성시간은 별로 궁금하지 않은데 자리만 차지하는것 같기도 하구요.. 입출금 내역에서 바로 메모확인까지 할수있다면 좀더 편리할 듯 합니다. 혹시 제가 사용법을 제대로 모르고있는것이라면 사과드리구요..,3,0,2016-09-25 18:12:23,2.2.0
34600272-49be-4491-861f-c3f8c0cd2288,알림올때 출금이라고만 뜨니까 정말 불편하네요 적어도 어디서 사용했는지 정도는 바로 떠야하는거 아닌가요? 가계부어플에도 그냥 출금이라고 입력되니까 하나하나 직접 수정해야하구요 어디서 썼는지는 신한은행앱을 들어가야 볼수있어요.. 왜 사용처는 안나오는건지 이해가 안되네요..,2,0,2016-09-18 13:23:12,2.2.0
4448734d-3735-40cc-8c84-37b5786ff59b,앱아이콘에 알림몇개인지 숫자 표시되는 것을 설정에서 끄기가 가능했으면 좋겠습니다. 알림표시를 다 지우는 스타일인데 간편보기로 확인한 알람인데도 아이콘에 표시가 되어서 지우기가 귀찮아요. 이미 많은 분들이 건의한 내용인거 같은데.. 고객들의 다양한 니즈가 바로 숫자 안뜨게 설정 가능한거입니다.... 고객이 알아서 필요하면 키고 없으면 끌꺼아닙니까 다른 은행 알림통지어플보다 알림관련 설정이부족하네요,3,0,2016-07-22 05:48:24,2.2.0
5f179141-fcac-4f03-94e3-f24b9daa9035,메인 폰이 용량이 부족해서 서브폰(공기계)에 깔아놓고 실행하려는데 전화번호가 맞지 않아서(없어서) 안되네요. 다른 은행은 다 되는데 여기만 안돼요. 매우 불편하네요. 전화번호가 다르면 인증번호 같은거 받아서 사용 할 수 있게 바꿔 주시면 좋겠어요. 다른 은행처럼,1,0,2016-07-25 11:26:30,2.2.0
77d3ff39-8d26-4907-81b7-c49090bd88a3,"푸스알림 만으로는 잔액 등을 알수없어 로그인을 자주 하고 있는데, 로그인 과정이 불편해서 짜등스러울 정도. 아니면 푸시알림에 잔액까지 표시할수 있도록 옵션이라도 주던가 ::: 개발자 답변보고 추가 - 개발자가 말귀도 못알아먹음. 로그인을 간편하게 하던가 푸시알림에 잔액표시 가능한 옵션이 있으면 좋겠고 했더니, 개발자는 엉뚱하게 로그인이 필요하다고 강변 중. 아 진짜 내가 -_-;",3,2,2016-07-14 09:33:35,2.2.0
be06f4b4-417b-44e7-be07-fd7682689144,"알림숫자가 불편하다는 클레임이 이미 많아보입니다만, 똑같은 답변을 붙여넣기 하기보다 신속히 수정을 하는게 좋지 않을까요? 예를들어 알림이 오고 숫자가 보이고 난후 어플을 작동시키면 첫창에 내역이 확인되니까 그때는 숫자가 지워지도록만 수정해도 훨씬 좋겠지요... 아니면 숫자가 언제 지워질지를 유저가 설정 할 수 있도록 한다면 사고 운운하는 답변이 불요하지요... 적극적인 대응을 바랍니다!",3,1,2016-10-07 10:30:15,2.2.0
c86945b5-5783-4e09-b3e2-c541c3d8f3b7,폰의 문제라고하기에는 삭제하고 다시깔면 한동안은 알람옵니다. 근데 시간이 지나면 다시안오네요. 몇년동안 잘오다가 어느순간부터안오는데 수정좀해주세요,1,0,2016-08-03 08:15:10,2.2.0
143fd136-c316-4afd-9beb-6006666497c2,"돈이 들어오거나 나가도  팝업알림이 하니도 안뜨네요. 혹시나 제가 알림을 껐나 싶어서 확인해봐도 정상이고, 앱제한하지 않음읋도 되어있고.. 다른어플들은 다 팝업알림 잘 오는데 유독 이것만 팝업알림이 하나도 안오네요. 그러면 굳이 이 어플 쓸 이유도 없고..",3,17,2016-08-19 06:23:51,2.2.0
175c1174-a324-45fd-bb73-6964125154b7,반응속도 정말 느리다. 그리고 쫌만 건들면 로그인하라는데...똥개 훈련시키나? 우리은행 알리미 어플 보고 좀 배우셔 정말. 급여계좌를 우리에서 신한으로 옮겼는데 왜 이리 앱들이 속도 느리고 비직관적인지 짜증 유발자.,1,1,2016-08-25 10:53:19,2.2.0
7d1fda35-87d0-4235-9987-3bac9dc755ad,뭐 안심통화 동의하라고 뜨길래 동의함 버튼 클릭하면 c9999오류 계속 나네요. 이 서비스로 적금 입금해야하는데 이거땜에 입금못하면 이자는 알아서 챙겨주나요? 얼른 고쳐주시길 ㅡㅡ 동의안함해도 똑같은 오류나고 있어서 켜지고 로그인도 못하소 있어요!!!!,3,0,2016-07-24 04:15:40,2.2.0
124c7886-1358-4f2b-a855-c70b01365591,내가출금.입금한 내역은 메시지가왔을때 로그인안하고 확인처리할수있게 못하나요?  알고있는내용도 궂이 로그인해서 홰인을해야 없어지니 불편합니다.,3,0,2016-08-19 02:20:16,2.2.0
47a12555-2eda-4fa8-9983-9015cc1e9ffb,나라사랑 받고부터 쭉 신한 썼고.. smail 서비스도 잘 이용해왔지만.. 출금 알림에 잔액도 같이 떴으면 좋겠다고 항상 생각해왔는데 smail같은 서비스 신한은행만 있는 줄 알고 그냥 썼어용. 근데 알고보니 국민은행도 알림어플 있네용 ㅎㅎ.. 잔액도 알림에 뜨고... ㅎㅎ 그럼 안뇽 정든 신한,4,0,2016-10-07 02:59:31,2.2.0
56477a9a-be26-467d-977c-0072a2ca331f,다른부분은 쓰기편하고 좋은데 지난거래 조회를 할때 3개월 단위로 해야되서 불편한 부분이있습니다. 그러니까 제가 2014년도껄 검색할려고하면 3개월단위씩 바꿔야 돼서 한참걸리는 부분이있는데 기간을 언제 부터 언제까지 한번에 설정할수있게 바꾸면 좋을거같습니다.,4,0,2016-10-05 12:49:16,2.2.0
6159d6e4-7324-45c5-b7e0-fd675cda38b8,갤럭시노트7쓰다가 리콜받고 새폰인 똑같은 노트7에 설치했는데 오류났다고 메세지뜨고 계속 탕기네요... 몇번을 지웠다 설차해도안되구요 백신검사도 다 돌리고 폰 리붓도해봤지만 안됩니다. 왜그런거죠...?,1,0,2016-10-01 02:35:32,2.2.0
cb0c642a-6c5f-4298-aa96-75f3ef774284,잘쓰고있습니다. 다만 입출금시에 푸쉬알림으로 내용정도는 알 수 있었으면합니다. 예를들어 10원/신한카드사용비 이렇게요. 수고하세요,4,0,2016-07-20 08:00:46,2.2.0
0482a17d-620c-47cb-9866-4de87482ddb2,입출금시 알림은 잘 됩니다만 앱이 깜박이는 현상이 발생합니다. 심지어 이런현상을 멈추기 위해 전원버튼을 오랫동안 눌러야하는 경우도 있습니다. 이런 현상이 지속되면 앱을 삭제해야할듯 합니다.,3,0,2016-08-17 00:11:54,2.2.0
b3b433d5-0646-4f67-a15f-39d794960b45,요 근래 넘 느려졌네요.. 이전에는 엄청 빨랏는데.. 요새는 로그인도 그렇고 목록 스크롤도 밑으로 해도 엄청느리네요.  서버작업때문에 느릴거라  넘겼는데  하루이틀도 아닌고 근 이주는 지난거 같은데.. 개선이 안된듯 합니다.,3,0,2016-09-12 10:34:20,2.2.0
54079747-3815-4c04-85cd-c9878d8b3a4a,와이파이나 데이터나 어떤걸로 해도 네트워크가 끊기네요.  가입도 안되고 도대체 비밀번호는 어떻게 찾는거죠? 계좌인증 하려고하면 비밀번호 설정하라 그래서 입력하고 완료누르면 네트워크끊겼다고 하고 꺼져요 답답해미치겠네요~,3,12,2016-07-25 11:17:23,2.2.0
5fd828a9-e9b1-4515-b284-34425d30445d,"1. 입출금내역 통지가 온 후, 앱 아이콘에 숫자 표시가 안되는 기능이 있었으면 좋겠어요. 숫자 떠있는거 되게 거슬리거든요. kb스타알림이 그런 세세한 기능까지 잘 만들었더라구요.   2. 비밀번호 누를 때 반응속도가 너무 느려요...",3,0,2016-08-25 23:44:39,2.2.0
ac420afd-8e3f-4498-9997-bc4907b4b7cb,"입금,출금시마다 알려주는건 좋은데, 앱에 들어가 확인을 해도 그대로 있네요. 로그인해서 조회를 해야 없어지는것같은데요.. 로그인안해도 확인하고나면 없어지게 해주세요",4,1,2016-09-29 00:19:57,2.2.0
b3b4e87f-3621-4a5f-addd-fa0197fd6afe,신한S뱅크는 드디어 8월 신버전에서 V10에서의 실행오류 문제가 모두 해결되었더군요. 그러나 S메일은 여전히 샐행오류문제가 해결되지 않은듯합니다. 빠른 업데이트를 부탁드리겠습니다. 수고하세요.,1,0,2016-08-22 23:07:23,2.2.0
df9649ce-9e8e-4dd0-8b39-17e71d2bb782,자꾸 이렇게 뜨고 들어가지지도 않는데 이거 뭐 어떻게 해야되나요 다른은행에는 다 잘들어가지는데 왜 이거만 그럽니까 용량 많아서 앱도지워보고 별걸 다해봤는데도 안됩니다 장사하는 사람이라 바로 확인도해야하고 봐야되는데 진짜 불편합니다 빠른도움주십쇼,1,1,2016-09-12 05:24:50,2.2.0
cb6c1ba8-f9c5-43e0-a5b8-b6298f3a439c,"메시지 확인 안할 때 뜨는 숫자 알림 표시 끄기 설정이 가능한지요? 아무리 찾아도 안보이던데.. 숫자 표시가 너무 거슬리고, 없애려고 일일이 메세지 열여봐야 하는 것도 번거롭네요..",3,1,2016-09-29 07:30:06,2.2.0
2b0b0b9f-8ec4-4704-b512-c19ee035bf5d,공장초기화 후 앱 재설치한후에 입출금 메일이 안오네요 지우고 재설치해도 똑같아요 왜 이러죠. 안드로이드 4.4.2 사용중입니다,3,0,2016-09-30 05:10:47,2.2.0
c26ad805-81d9-444d-a9c4-5708996f6642,앱 아이콘에 숫자가 뜨는 기능을 끄는 것도 가능했으면 합니다. 또한 PIN 6자리 로그인 뿐만 아니라 지문 인식 등으로 간편하게 로그인 할 수 있었으면 합니다.,3,0,2016-09-13 08:38:38,2.2.0
5109cb9e-fa8c-4656-b60c-61ff8bf55e15,좋은데... 이 기능을 신한S뱅크에 통합할 계획 없으신가요? 단지 입출금 푸시 알림을 받기 위해 별개의 앱을 깔아야 한다는 게 아쉬워서요. 혹시 신한S뱅크 앱에 있는 기능을 제가 모르고 있는 걸까요?,4,0,2016-08-31 07:51:27,2.2.0
09e75aa8-d080-4a6b-b78e-a8f683c95b5e,안녕하세요. 각종갖고잇는 계좌중 주택청약 통장만 등록이되어있지않은데 왜그런건가요? 신한 s뱅크가면 분명 인식은되는데 smail에는 인식이 안되는건가요??,4,0,2016-08-20 15:09:48,2.2.0
4780b9f6-bccf-4767-aade-008d70fadef2,카드 긁으면 얼마 썼다고 알람이 오는데 얼마 남았는지는 항상 들어가서 확인해냐하니 조금 귀찮네요..하나은행처럼 잔액이 얼마인지까지 나왔으면 좋겠어요!,4,1,2016-08-23 08:01:38,2.2.0
a8aeb817-f398-47c2-8019-10fe4bcc7db5,"신한s뱅크앱에서 알림기능을 넣으면 되지 왜 쓸데없이 앱을 여러개 설치하게 만들죠?  국민은행,sc은행,농협,우리은행을 이용했는데 이렇게 앱을 나눠 놓은건 신한은행 뿐이네요",1,0,2016-09-01 13:42:18,2.2.0
87419feb-8c3f-4e1f-b786-214c166a8040,국민은행 어플은 그냥 알림보내주고 상단에 떠있는거 지우기하면 되는데 이거는 알림받고 숫자가 계속떠있어서 어플에 들어가서 확인을 해야 숫자가 없어지네요 그것좀 수정해주세요 계속 신경쓰이네요,3,0,2016-08-01 17:58:38,2.2.0
42284af8-0d08-419d-8c5e-de0deccefb1f,넥서스5X가 오늘 누갓으로 업뎃됐는데 업데하구나서 보안엔진 연결에 실패했다면서 실행이안됩니다.  수정!! 정말 빨리 대응해주셨네요. 잘 됩니다. 별점 올려요~,4,1,2016-08-26 01:13:44,2.2.0
6197d674-3338-4630-b1bd-e0c6d5eb5dfb,와이파이도 아닌데 네트웍이라니? 것도 지금까지 잘 되다가. 지우고 다시깔고. 몇번? 이젠 등록이 안된폰이라니?,1,0,2016-09-26 12:03:49,2.2.0
ce50f182-0f4c-4488-aa92-9e8538dcc64f,동작은 잘하지만 상주 메모리 크기가 너무 크니 축소바랍니다.  재시작을 자꾸해서 휴대폰이 버겁네요. 수정 부탁드려요.,3,0,2016-09-23 11:32:13,2.2.0
a324377c-8be9-4431-b22b-fadd964dbae2,최근 권한 업데이트 이후에 이상하게 배터리가 급속도로 닳아서 배터리.내역에 보니 이 앱이 30펀가 혼자서 먹고있던데 앱 웨이크 숫자고도 2000번 가량 되고요 어떻게 된건가요?,3,21,2016-07-12 11:12:52,2.2.0
11ccebd9-9b1f-4177-a1a3-ec0b576bb935,업데이트후 로그인 하여도 입출금 알림 하나도 안옵니다. 여러사람 불편해하는데 오류 좀 빨리개선해주세요,1,0,2016-08-05 16:20:58,2.2.0
bef00536-f86d-45a6-b76f-be79eb1466bb,별1개도 아깝다. 업데이트 할때마다 다시 앱을 실행해야 동작을 하니 앱 업데이트 되었는지 일일이 확인을 해줘야 하나?  이거 만든 사람은 뭔 생각인지??,1,13,2016-07-14 01:07:44,2.2.0
357323ee-37cd-43e2-949d-e2eab85e5a02,네트워크 연결이 안된다고 (c100)이렇게 떠요....왜그러는건가요???5번하면 3번은뜨는거같아요 불편하네요,3,0,2016-09-26 12:10:31,2.2.0
