reviewId,content,score,thumbsUpCount,at,appVersion
86b50cf0-1686-48a1-8cb3-e1a660776877,입출금 알림 예전처럼 잔액확인 됐으면 좋겠어요.,1,2,2024-08-12 03:05:51,4.1.1
1c6c310f-802c-4157-b110-54eb46d0118e,그냥 좋으니까 다 까세요 강추합니다,5,2,2024-07-24 09:39:52,4.1.1
00b1d8da-3c5f-4187-b4ff-94e8de5a8426,나의 자신. 관리하며 포인트 모으는 자미 쏠쏠 금융상식도 쌓아요~,4,0,2024-06-22 23:43:35,4.1.0
87cc1681-4ed3-4b20-8ee0-7292c1828aca,포인트 쿠폰 받으려고 이어플 설치한다? 쓰레기 눈가리고 아웅 사기꾼들임 뭐 투자금융증권 수락 이런 문구들만 나오고 의미 하나없음 걍 사기임 시간도 오래걸리고 하나하나 인증해야돼고 그럴빠에 제돈주고 먹고맘 이런 쿠폰류나 서비스류 질 떨어지는거 감안하면 10분 20분 쓰는거 아까워죽겠음,1,2,2024-08-08 08:57:25,4.1.1
f45dd1d2-4686-4b53-af9c-237fd371f17b,알림을 다 꺼놨는데 오ㅑ 알림이 오냐,1,1,2024-06-13 01:58:18,4.1.0
af77783d-f0cc-4e08-aeeb-03c63e2c7d04,포인트도 받고 심심풀이로 좋아요 추천합니다,5,0,2024-07-04 01:53:25,4.1.0
f35feaa9-d3df-47cb-b427-c3b1be35f5d0,항상친절하셨어서감사합니다,5,0,2024-07-09 12:06:46,4.1.0
d6852a66-7aab-4790-a215-4bdb5f2f5484,입.출금 내역 확인하면서 간편 계산기 기능은 왜 삭제가 된건가요? 어플이 더 쓰기 안좋아진거 같아요.,1,2,2023-12-20 09:19:08,4.0.0
57a3fc7b-4c30-4382-9980-3379995f8480,최악임 기존 신한어플 써야하는게 더 많고 모바일otp발급을 지금 몇번째 받는지 모르겠음 짜증나서 삭제예정임,1,2,2024-04-16 01:26:00,4.0.6
a5f1b5b7-4866-4bc0-86fa-1fe2a7b21d66,카드 이용내역 조회시 오류 팝업이 뜨면서 이용내역이 중복 표기 되네요. 그리고 카드 이용 금액은 결재일기준으로도 확인 할수있게 추가 바랍니다.,3,0,2023-12-27 00:48:02,4.0.0
d1b609e5-e839-4d2a-9c9e-796a999ed0e9,요즘 알림이 잘 안와요... 가계부랑 이 어플이랑 연동시켜놔서 알림오는걸로 기입했었는데 알림이 안오니까 다 꼬여버렸네요ㅠ 해결해주세요,2,2,2018-11-03 16:10:06,3.2.1
c885ae24-665f-4f20-9186-7009c5820942,쓰다보면 주기적으로 v3가 정상적으로 작동되지 않는다는데 이거 뭐에요 대체 짜증나 죽겠네,1,4,2020-03-06 00:52:08,3.4.8
ed57b561-54bb-4d16-bec4-ae7e20aa66fa,자주 이체해야할 계좌들 그룹별 관리가 없어져서 너무 불편하네요. 그래서 기존 앱을 사용하게 되네요,2,4,2023-12-22 13:18:04,4.0.0
10b3980e-24f2-473a-876b-b4e2055d1638,몇년 사용했는데 알림이 언제 부터 안오네요 어플 들어가도 설정은 이상 없는거 같은데.. 답변 없음 은행 바꿔야죠 알림 안오니 불편하고 짜증나네요,2,5,2021-05-09 01:51:20,3.6.1
198fbfe1-98bd-49aa-8fd7-43ceb4ac9e64,기존 신한은행 앱보다 화면에나타나는 정보가 알기쉽게 작관적으로 잘 나타나있음 포인트까지,5,3,2024-04-27 10:52:24,4.0.7
7aa5ac23-4387-4b8e-868a-98d55f8a83d6,휴대폰도 잠금설정이 되어 있는데 자동 로그인 설정을 해두어도 자꾸 풀립니다.,2,1,2019-02-04 13:35:02,3.2.5
e855985e-63be-4641-9bd2-ba5bc9ffd8ea,무한 로딩상태에 들어감 제대로 켜지지않음 알림도 제대로 오지 않음,1,1,2019-02-05 09:56:19,3.2.5
961d6c92-eda6-4833-a615-6c8e1f9f07e8,내 돈의 흐름은 역시 신한 슈우퍼SOL과 함께~~~,5,0,2024-07-15 12:13:17,4.1.0
d26017f4-6a8f-411e-a37f-36bb70126c2a,신분증 인증등록부터 계속 실패. 자동촬영인식된것 맞아도 계속오류나요.,1,1,2024-01-15 06:19:02,
148087f2-11f2-4c3d-bb24-66df34912931,고쳐주세요 위로 스크롤 올릴때마다 지멋대로 새로고침하는데 왜그런거죠 좀 고쳐주세요 몇년을 써도 똑같네,2,6,2020-07-28 04:54:39,3.5.2
42e1319d-fab2-404b-be0c-dee789082c1b,아오 전화번호 변경 계속했는데 수정이 안돼; 제발 이 쓰레기 같은 앱 좀 제대로 만들어,1,0,2024-09-12 08:28:36,
1928c10a-c8aa-42c3-8791-93bfe105c536,노트9 안드로이드10에서 로딩중 검은화면나오고 실행 안됩니다 빠른 조치가 부탁드립니다,3,1,2019-12-11 14:03:07,3.4.5
054fb70c-717e-4fcb-b9df-d63889d6429a,아주 편리하게 사용하고 있습니다,5,0,2024-07-21 23:00:13,4.1.0
2d599150-26a3-4be3-90f7-59206e1fdf7f,외국인은 인증할때 영문 이름에 성/이름 사이 공백이 필요한데 공백입력이 안되네요 신용카드 인증 이후 본인 휴대폰인증에서 진행이 안되 사용불가네요,1,1,2020-06-28 13:07:26,
b52399ff-02eb-4e2f-b68e-c7fa93e46dfe,용량이 작아서 하나만 사용하고싶은데 이체나 입출 .카드사용을 앱하나로 사용하고 싶은데 그게 잘 안돼네요,2,1,2020-07-01 02:14:14,3.5.1
98de8dd3-3e07-4781-a554-87046dde2afd,계좌 인증 후 자동으로 꺼짐. 가입도차 안되어서 앱이용이 안됨.,1,2,2023-12-22 13:14:43,
44ce4de1-dc9e-4a16-a946-efac318dad63,자동로그인이 안되네요 들어갈때마다 다시시작하기한다음에 비번누르라는데 귀찮게스리,3,0,2019-01-29 07:53:27,3.2.5
74e3173a-6c91-4ba0-8c7f-5b37dccdd652,하나로 다된대서 기존거 다 지웠더니 안되는게많네요.. 은행이랑 증권앱 카드앱 다 다시깔았네요,1,3,2024-05-02 05:36:02,4.0.8
e7787111-6797-42ea-99ae-0fd42c36315a,너무 불편합니다 카메라로 pc qr결제 기능 및 매점 현장 결제 기능 추가해줬으면 합니다,1,1,2024-01-31 07:38:44,4.0.2
b1d8da37-75b6-405e-afe7-29de34280485,잘 사용하다가 업데이트후 강제종료됩니다. 빨리 오류 수정바랍니다,1,2,2019-07-09 00:23:35,3.3.6
291423f9-e7c5-4ba6-b5ad-5cd90f7485ba,차라리 슈퍼솔로 통합했음 좋겠음 불필요한앱까지 깔 필요가 없음 핸드폰 용량만 괜히 차지하고,3,1,2023-12-30 23:45:14,4.0.0
f1a654a3-906d-41b3-960c-e2ec22b6fd6d,"예전 쏠 알리미는 계산기능 잘 사용 있었는데 최신 신한뱅크 앱이나 중복되어 사용이 불편합니다,",1,5,2023-12-18 07:05:06,4.0.0
4a944c3e-66e6-4e3c-ae32-d662d123b316,어이가 없네 상위호환도 안되고 어떤건 구형 앱사용하라하고 통합 할줄 모르는 기술이면 어플 만들질 말아야지,1,1,2024-05-17 12:25:54,4.0.8
b3ae0dde-4a68-45d0-896d-be27a2724538,나같이 빠쁜 사람한테는 너무나도유용하다.신이절약된다.수시로 확인가능한다.,5,2,2019-05-14 15:55:50,3.1.9
102d0062-a397-4ce8-96c0-cad5ab298c7e,업뎃됐다고 해서 실행하는데 생체등록안내에서 넘어가질 않아 3번이나 다시했는데 안되네요....답답합니다아,1,1,2023-12-26 13:40:24,4.0.0
e29fc6b4-57ea-4d39-adeb-b24b4a2de5d9,신한은행 OTP 발급하려는데 ARS 인증 전화 받으면 앱이 꺼져서 처음부터 다시 해야 돼요 ARS 인증을 못해요,1,2,2024-02-14 18:37:48,4.0.3
f2be97c3-3d9a-4c85-90cb-4aebfcc57137,개선사항 1. 법인카드 앱결제 기능이 안됩니다 2. d-club 관리 페이지 들어가는 기능이 없습니다,4,0,2023-12-21 09:25:01,4.0.0
6990f86e-8491-4434-8c03-3f7c8b823e02,기존 앱들의 기능을 다 담아내지 못하는 거라면 이걸 왜 써야 하는지 모르겠네요ㅠ 결제하는 방법도 잘못 안내가 되고 있고요. 기존 앱 다시 깔고 삭제하려구요.,2,1,2024-01-15 00:02:40,4.0.1
5ca732ee-8086-4258-9692-1e9403074fa8,"요즘 왜갑자기 알람이 너무 늦게뜨죠??? 원래 돈 출금이나 입금되면 바로 떳는디,, 갤럭시s9사용중입니다",2,19,2019-01-13 14:24:11,3.2.5
07dfb527-de72-417f-834e-ef1d24965c07,업데이트 후 아예 멈춤~ㅠㅠ 다른 앱에도 악영향! 앱제거도 잘 안되네요~ㅠㅠ,1,2,2019-04-27 01:02:42,
9f3e5119-54ce-4900-94a1-9d7f320a501b,업데이트하고 더 안좋아진거는머지. 편하게 쓰던것들이 다 사라졌네,1,2,2024-01-22 03:00:10,4.0.1
8f994bd4-9256-42f8-abc4-4ba84f81e151,게임 2개를 다운받을시간에 어플이 켜지네요 1인 게임 크리에이터도 앱을 이따구로 관리안해요 그만 처 놀구먹으세요,1,0,2022-03-05 11:17:34,3.6.7
a2f97f5b-a36d-44b2-872b-aea882497cdd,기존의 알리미로 바꿔주세요.. 알리미 기능만 사용하는데 너무 무거운 앱이네요,1,6,2023-12-25 01:28:12,4.0.0
926d82d7-df43-461c-a01f-0963c590852b,나 신한카드는 쓰는데 신한은행 안 씀... 예전 계좌개설한게 있는 모양인지 은행에 등럭된 전화전호만 가능하다고 하네... 하지만 내 입장에서 쓰지도 않는 은행 정보 갱신한다고 비대면 추가인증 왜 해야 하는지 모르겠음... 어차피 카드쪽 정보는 가짜인건가? 은행 말고 다른 서비스에 등록된 개인 정보도 인정해줘야 하는 거 아님? 암튼 이벤트때문에 가입 하려다 귀찮기도 하고 여기 리뷰 보니까 기능 부족으로 카드 어플 삭제도 못 할거 같으니 걍 안 살치안하고 지웠음.. 이거 통합 아이디어 낸 사람 좀 혼나야 함,1,0,2024-01-11 06:54:07,
cb54faf3-a8f2-48e5-a94d-cd12827a6ac7,공동인증서나 모바일 OTP 제공이 안됩니다. 기존 솔 앱이랑 충돌이 나고 홈페이지 안내내용과 다릅니다.,1,1,2024-01-18 12:34:52,4.0.0
1136789a-bf03-4e96-b9e4-17ce15c76168,다 합쳐서 하나로 만들었는데 조금 느리네 보안도 믿을 수 있는건지 어쨋든 하나로 만들었다는것,5,1,2024-04-03 05:55:48,4.0.6
a5a20084-2cc6-4ef3-82b9-798b80d787ef,평생계좌번호 폰번호바꾸고 다시 설정했는데 앱에는 그대로 과거번호 계속표기되어있네요. 업데이트 바랍니다.,5,4,2023-12-24 07:26:57,4.0.0
7b8286ef-2491-478a-920c-122c2f5d0e0f,매번 은행에 찾아가지 않아도 앉아서 앱 연결하여 비번만 여섯자리 누르면 입출금 확인할수있어 너무 편하게 사용중입니다,5,2,2021-06-24 08:28:32,3.6.1
979ecdd5-23fe-4943-b3df-183e921efa01,"본인명의 핸드폰만 회원가입이 되네요ㅠ 은행에 등록해 놓은 번호와 명의자 핸드폰 번호가 불일치하여 회원가입자체를 못함, 다른경로, 즉, 신한카드 등 으로 회원가입할 수 있도록 요청드립니다 또는, 은행에 등록해 놓은 번호와 명의자핸드폰이 불일치하더라도, 은행에 등록된 번호로도 인증받을 수 있도록 해주세요",1,0,2024-05-10 16:13:56,4.0.8
00872fe6-f8bf-44f0-aed8-189194a86585,시작화면에서 자꾸 실행이 안되거나 느리게 실행되네요 빠르게 실행이 되면 좋겠어요,1,5,2021-08-26 07:20:16,3.6.3
779c8500-462a-423a-a987-1c4885c61438,V3가 정상적으로 작동하지 않는다는데 업데이트도 없고ᆢ 어찌해야합니까? 밑에 의견보니깐 다시 깔아도 안된다고 하던디ᆢ 해결해주세요~,3,5,2020-03-23 03:23:45,3.4.8
5bde45e7-75f7-42a7-91f2-c1ef6cd9494c,이거 왜 만들었나요? 입출금 알림이 가장 중요한건데 알려 주지 않으면 어쩌란 말임? 나만 그런줄 알았는데 많은이들이 똑같은 글이네. 담당자들은 임직원들껀 잘되는지 신경끈거 같음. LgV35기종임. 이거 지우고 은행어플도 사용해보니 마찬가지로 작동안함. 설마 어플관는 두손 놓은거 아닌지 민원이 많이 들어 갔을텐데. 벌써 몇날이 지났는데도. 빠른 시정조치 바랍니다.,1,25,2018-11-19 11:26:05,3.2.1
cd19c1f9-5c95-4e75-955c-9ca1bbc7cb36,문자 자동등록 핸드폰가계부를 쓰는데 문자가 잘 오다가 안오는 업체가 생기네요. 쿠X 결제 마지막 문자가 6월 15일이네요. 그럼 다른곳도 있을거같은데.. 철썩같이 믿고 쓰다가 덕분에 가계부에 빵꾸가 심하게 낫네요.,1,0,2019-08-13 15:15:51,3.3.8
86714a8f-8494-4e35-b0d1-ceea90e83736,원래 이렇게 이체할때마다 모바일 otp를 새로 발급받아야해요?안그랬던거같은데 너무 불편해요. 이럴거면 그냥 otp실물카드를 주시죠 ㅡㅡ,1,1,2024-02-14 04:30:58,4.0.3
c8006cd1-0ddf-4aa1-bb99-88bdf360b1ed,최근에 v3가 정상적으로 구동이 안됐다고 계속 팝업이 떠요 해결 좀 해주세요 애용하는데😿,4,4,2019-11-24 08:50:21,3.4.4
71852c98-c01e-49ac-997a-5f5aaf8e1c93,저처럼 은행 카드 이렇게 여러 회사를 이용하는 사람은 사용하기 너무 편해요~ 포인트도 많이주고 좋네요~~,5,2,2024-03-13 02:14:18,4.0.5
4a9cdc58-3e26-4fc2-8c41-e7188ae0fd9a,super sol로 완전 통합은 아닌가 봄 모든 기능을 다하지 않으니 이건 이거대로 은행 증권 카드 앱 다 깔아야하는 데 뭔 의미가 있나 싶음 사실 별1개도 아까움,1,2,2024-02-28 04:23:26,4.0.2
83abf055-0569-484e-b2bf-d4951fe07e12,기능도 없는데 무슨 핵심 서비스가 통합됐다고? 딱 예전 쓰레기 같은 알리미 앱 수준임.,1,1,2024-03-10 02:36:28,
0e2a65e1-4aef-451e-955d-aab1c357f268,알림이 안와요 오늘 이체되는날인데 알림이 안와서 빠져나갔나 들어가보니 출금내역에는 있네요 출금될때 알림이 바로와야하는데 이렇게 안오면 앱이 소용없지않을까요?,1,2,2018-12-26 11:06:49,3.2.3
a8f310a9-d7d7-4b6a-a934-d255927d9517,기존신한카드 대제하는것도 아니고 결재하려했더니 sol에서 앱카드 발급받으라고 결재도 못하고 통합을 하던지 대체 뭐하러 만드는건지,1,1,2024-01-25 01:29:48,4.0.2
a47cdfdc-32ff-477a-a71d-383a61a3300b,아니 체크카드 결제 후 잔액은 왜 안나오게 바꾼건지 이해가 안가네. 잔액안나오면 그냥 문자서비스 받고 말지 이걸 왜쓰겠어요. 승인예정 이런거도 필요없고 그냥 전처럼 승인내역이랑 잔액표시되게 다시 바꾸시길,2,15,2018-10-16 03:54:45,3.2.1
304fda0e-7a79-47d0-9137-51a9f4063e15,회원정보 확인중..이라고 오류발생 이 떴어요 다시로그인 하라고 하면 자꾸 오류 생겼다고 계속떠요,3,2,2021-07-09 22:31:31,3.6.1
7da666a7-767d-4027-97ae-b3d18313e0f1,청년패스 가입하려 했는데 서비스 일시 중단ㅋㄱㅋㅋㅋ 뭐하세요 도대체 언제 하라는거임 주거래은행 따로 있어서 안깔고싶었는데 하 진짜 청년패스 하기로 했으면 서버를 제대로 해놓든가,1,0,2024-05-09 17:04:48,4.0.8
3308ea02-5a20-48ca-8a51-f12d6d956976,가입 이벤트 권유코드를 왜 나중에 입력 못하나요. 이벤트도 진짜 이상하게 하네. 주기 싫어서 일부러 그렇게 만들어놨나,1,0,2024-05-08 03:04:54,
930b3dda-c937-4151-b4db-307965ac2c17,잘됐었는데 언제부턴가 낮에 결제했는데 저녁에 빠져나갔다고 알려주네요~ 너무 뒷북아닌가요,2,1,2019-01-08 10:17:03,3.2.4
f4e77158-b941-44ab-8f89-fdf98a6df3b8,지인 요청으로 깔았는데 기존 앱에 비해 뭐가 좋은건지도 모르겠고 신한인증서 알림은 오지도 않네 이따위로 할거면 왜 만들었냐?,1,1,2024-01-21 05:08:20,
c67ab83e-d4c5-4196-adac-ea196f4b6f73,11월 5일 업데이트 이후 자꾸 문제가 생기네요. 전화만 오면 충돌합니다.,1,1,2019-11-12 09:09:46,3.0.6
74e367bd-0125-4d0f-b0d1-9007f3aa8e6b,신한 슈퍼SOL 사용하기가 넘 편리하고 좋아요 퀴즈문제도 풀고 만보걷기와 물마시기 이벤트로 건강도 챙기구 굿굿👍,4,3,2024-03-17 14:29:00,4.0.5
0ca0262a-203b-48fb-b5be-f0b73629c893,알림음 상세설정이 안되요 수정 부탁드립니다 스마일 쓸때는 안그랬는데...,3,1,2018-12-21 04:45:41,3.2.2
5807c35b-3f92-4115-aac9-cc258b0b2716,1년 전에 깔았다가 알림이 전혀 안 떠서 삭제하고 안 쓰고 있었는데 다른 은행 앱 쓰는 지인들이 신한은 왜 알림 안뜨냐고 알림 뜨게 설정해두는 게 편하다고 그래서 다시 한 번 깔았더니 1년 동안 발전한 게 없네요; 앱 개발자분께 죄송하지만 진짜 이런 앱 만들 시간에 다른 걸 하시는 게 더 인생에 도움이 됐을 것 같아요. 결론은 1년 지난 지금 2번 연속 삭제하러 갑니다. 절대 다시 안 깔 거예요. 차라리 알림 잘 뜨는 다른 은행에 계좌 새로 만드는 게 제 심신안정에 도움이 될 것 같아요,1,8,2019-06-02 12:50:54,3.3.3
73ee1e06-e40b-4911-8566-fd09f7c3fe33,신한쏠앱에 기본으로 넣어주시면 안되나요? 폰 용량도 부족한데 앱을 또 깔아야하니 번거롭고 부담되요,1,1,2020-02-02 19:11:34,3.4.6
9273d976-1a78-4c8e-a0b3-a5e4c31c1d79,앱알림에 입출금시 잔액이 표시되지 않아 불편해요 솔뱅크에서 입출금 알림 잘오고있었는데ㅡㅡ 다시 솔뱅크에서 알림오게하려면 어떻게해야하나요,1,1,2024-01-31 20:26:23,4.0.2
75c47062-5d29-4416-adeb-27ea71bea073,이름입려 안되고 계속 다시 인즏하라하고 그전꺼 다시 복원 하든지 너무 실망스런 앱 입니다,2,1,2024-03-09 21:40:12,4.0.4
1ab3ddc9-6460-470c-8ac5-4553ea45f4de,몬 바이러스땜시 설치늘 못한다고 하는게 몇달째 지속임.. 그사이 폰도 교체했는데 여전함.,1,1,2024-03-02 03:50:27,4.0.0
6e1d2956-ea10-471a-8b17-a14438923d1d,여태 잘쓰다가 이번 업데이트 후 알림이 안옵니다. 빠른 조치좀.,2,1,2018-09-20 01:24:15,3.2.1
879269ae-7f63-410b-b111-411c1d4cadfc,버전3.5.7 오늘 업데이트 했습니다. 신한SOL알리미 계속해서 이용하고 있습니다. 별5개+2020점 만점 까지 드리겠습니다. 신한SOL알리미 화이팅!!,5,20,2020-11-21 05:49:39,3.5.7
7f8a8dad-3743-458b-b458-fa365c5334ed,간편하고 도움이 많이 되는 앱입니다 더 많은 기능들이 추가되길 바래요,5,0,2023-12-19 10:39:48,
b79a0854-86c3-4f3f-9c96-4ecec5f644ab,저금통이 안보입니다 비우기가없어요 기존 쏠은 있었는데 슈퍼쏠에는없습니다 수정이 필요합니다,2,1,2023-12-26 04:10:53,4.0.0
d6ad04e8-468f-4a20-a133-5bad5e6c5888,"V3문제는 도대체 언제 해결 되나요?입,출 알림 외 등등 사용 할 수가 없어요 굉장히 불편하네요",1,20,2020-07-05 10:50:51,3.5.2
48f419a9-2e38-4b94-a3b4-49af40fc0313,알림도 하나도 안오고 전화올때마다 뜬금없이 이 어플이 응답없다면서 종료하시겠냐고 뜸,1,1,2019-01-18 00:13:33,3.2.2
bc52400c-5b15-411d-b7ad-e07f83dd32d0,로그인이 왜이렇게 안될까요 로그인 지연 문제 해결해주세요 업데이트 후 더 안되는 것 같네요,3,1,2019-04-25 10:38:45,3.3.2
f60ea43b-d30b-49fd-a613-c14940ba2d7b,"이번 업데이트 후에는 증권 알리밍이 안되며, 앱 오류가 있네요. 추가 업뎃은 관심이 없나보네요?",1,0,2019-08-14 06:27:49,3.1.1
607c64e7-90ff-43ff-ad69-b7aea52fc341,앱이 안열림 이체도 못하고 하.... 이따위로 무슨 통합... 카드 알림 문자 안오는 옵션좀,1,0,2024-01-25 07:26:16,4.0.2
37708f0d-09ef-4c2d-b27b-e75c279f469c,아니 카드결제예정 금액을 볼수있게 해줘야지 매달 사용금액을 볼수있게하면 어떻하나요 바꾸는법도 모르겠고..,1,0,2024-05-11 23:26:26,4.0.8
fa4e0648-457c-48e1-a365-dee5becf0b45,오픈뱅킹 하려면 앱 업데이트하라는데 정작 나는 최신버전인데 어쩌라는건지 모르겠네 앱 쓸데없이 두개 세개 네개 만들지말고 하나라도 제대로 만드는게 어떠냐?,1,1,2024-04-01 04:41:34,4.0.5
c42d139c-f03a-41be-a245-3f698a630f72,새로깔면 며칠뒤 또오류 뜨고 카드클릭하면 보이고 은행은 오류뜨고 반복이네요 전에는안그랬는데 업데이트후그러네요 보아하니 모든분이그런거같은데 오류안잡나요? 이럴바에는 알림앱을없애는게....짜증나서 안쓰고싶네요 다른분 답변에 공유하면 그런다고 하시는데 저혼자써도 그러네요,1,6,2021-07-10 01:56:17,3.6.1
59f4af9c-eab1-45f9-9c7e-d26e9446c71a,왜 자꾸 로그인이 안되고 종료되는 거죠? 지우고 다시 깔아서 회원가입도 다시 했는데 안되네요.,1,3,2019-05-02 03:44:27,3.3.2
84ebbf48-1561-4a35-99e2-7be60b1424d5,오류나요 갑자기 서비스가입안되있다하고 재가입하고 들어가니 또 오류창떠서 꺼지지도않고,1,3,2021-11-12 09:29:24,3.6.5
c9d9cf27-c7eb-42d6-98d9-56227cfb284b,오래전부터 입금알림이 계속해서 안되네요. 출금알림은 되는데 말입니다. 문제 시정부탁드려요.,2,1,2019-11-12 02:28:06,3.4.3
c1126c3d-e853-4ef9-81ba-f5fe198e4032,갤럭시 S9 바꾸니까 알림 잘 안됨. 상담원에게 3번이나 전화했는데 해결못함,1,2,2019-01-10 10:04:08,3.2.4
2053bf07-c608-4f71-92d1-864a12b969b9,되는게 뭡니까 느리고 검색도 안되고 어플 받으라고해서 받으니 기존어플 다시 쓰라고 하고,1,2,2024-02-28 22:17:16,4.0.3
15005ee2-5f4f-4f2d-b15a-83e83dbbd1f4,간편해서 또 수수료도 없어서 너무 좋아요 이벤트가 조금 더 다양했으면 더욱 더 좋겠읍니다,4,1,2024-01-08 06:22:39,4.0.0
de3f5c22-a5d9-4298-8d9a-e19f345b0d25,V3가 정상적으로 구동되지않았다면서 구동이 되질않습니다.,3,4,2020-02-19 11:44:24,3.4.7
51b41bb8-b7ac-4c0c-8cc2-71fd0b4a3925,전 폰하나만 쓰는데 다른 기기에서 가입한다고 어쩌고 뜨는데 어이가 없네요 어플2개로 잘쓰고 있었는데 뭘 또 늘리다니;;,1,3,2023-12-20 04:11:40,4.0.0
eef4a8a1-afca-4b14-9015-8b2f4d8a27eb,신한슈퍼sol 손쉽게 알수 있어 아주 유용하게 잘 사용합니다 나날이 발전하는 신한이어서 완전 좋아요👍,5,3,2023-12-21 14:25:48,4.0.0
aa030574-34d7-40aa-8d22-dec3a589c2fb,"알림이 왔을때 쓸데없는 시분초를 보여줄게아니라 입금자와 금액을 보여줬으면좋겠다 간단하게 날짜, 송금인, 금액 이렇게만 보여주면 좋겠다",3,2,2019-04-10 02:24:33,3.3.0
7c2e609e-794a-4b0d-83a8-1b2d2c20e228,돈 출금 되고 팝업창 떠서 누르면 핸드폰이 엄청 느려짐 한번씩 폰이 멈춤.... 갤s10+,2,2,2020-12-27 00:50:05,3.5.8
bc95c7a5-20a8-4d3f-b513-5278bd75b377,가입단계에서 신한인증서가 없다고하여서 가입이 안되는데요.왜 그런가요?신한인증서는 있는데요.,3,1,2024-02-01 03:51:53,4.0.2
9b1c35cb-ae56-4f43-a70c-ab2275bd8641,전화올때마다 솔알리미가 중지됐다는 문구가 갑자기뜨네요ㅡㅡ짜증나서 삭제했네요,1,2,2019-11-13 17:36:38,3.4.1
53da8644-c0b2-48f5-85d0-44ff5cf664fc,아이놔 설치하고 인증하고 가입하고 설정 하고 다했는데 다시 앱켜면 가입페이지만 나옴 하라는건지 말라는건지,1,1,2023-12-26 02:40:04,4.0.0
2c755de4-bdfb-40f8-af94-ff0d676eaccf,조회도 오류 많고 찾기도 드럽게 어려움 왜 바꾼 거임? 뭐 개선이 돼야 바꾸는 거지 참 아휴,1,1,2024-02-22 23:49:12,4.0.3
3e84e1ae-6e0d-4ec8-abd1-269e876f0505,폰 바꿔서 쏠알리미 새로 깔고 가입 절차 다 하고 가입 하려는 순간 '장기 미이체'로 사용할 수 없다고만 뜨고 전화로 문의해 가지고 SOL로 들어가서 시키는대로 했더니 또 에러창 뜨고 참 가지가지한다 ^^ 너네들 은행 얼마 안가서 망할것 같으니깐 묻는 말에 잘 대답해라 응?? ㅎㅎ,1,7,2021-01-25 18:33:01,3.6.0
52835b50-b445-4384-8f92-49d9263a7618,이렇게 불편한 알림 어플은 처음. 매번 구글인증 해줘야하고. 콜센터에 불만 접수해도 개선도 안되고. 관리 안할꺼면 없애든가,1,7,2020-04-27 22:56:05,3.5.0
4981196e-1bdb-4813-a893-8bcc3bc478d1,갑자기 로그인 인증하라더니 교통카드도 안되네요 지금 집에 가야하는데 차도 안되고 이거 보상 받을수 있나요,1,2,2024-02-29 13:23:15,4.0.1
3bfed947-1b3f-44d5-b872-587a3603c739,존재 의의를 모르겠어요. 결제나 이체가 안되니 결국 기존 카드앱과 은행앱을 쓰게 되고… 알림기능은 그냥 기존 알리미 어플 쓰면 될거같은데요.,1,3,2024-04-23 16:50:53,4.0.6
7b560a1e-3bae-499a-89fe-f00f59ffc180,갑자기 V3정상가동 불가라며 계속 접속불가 신한증권도 들어가지는데 뭔 이따위... 조치 안함... 업뎃 할수록 구려지냐,1,4,2020-05-01 11:08:10,3.5.0
1259e054-051a-4580-a4b8-d74eb6fd397c,알림이 왜안오죠? 예전에는 입금되고 빠져나가고 꼬박꼬박 알림도 잘오든데 다시 정정해주세요,1,1,2019-02-13 01:35:33,3.2.5
f6ca1efa-7118-45a4-92c0-2fc244d23234,"이 앱의 용도가 뭔가요?? 카드, 은행 앱의 일부만 넣어서 결국 카드, 은행 앱을 설치해야 본연의 기능을 사용할 수 있는데 대체 이걸 왜 만들었어요?? 쓸데없는짓 참 잘함.",1,1,2024-01-13 08:32:14,4.0.0
875279e8-56a3-4830-858e-81162ae23a89,다양한 이벤트와 보기 좋은 어플활용 기존보다 많이 개선되어 정말 활용도가 높아요~~굿,5,2,2023-12-20 20:20:14,4.0.0
7576f4fc-3408-49f1-9993-6667afc142ca,바뀌고 진짜 이상해요 새로 발급된 카드도 제대로 인식 못하고요,1,2,2024-02-21 02:11:06,4.0.3
8c9da3d0-0c86-46c9-b559-fc6a15dd8c60,업뎃 괜히 했네요 알림가끔 안울리고 전화할때마다 종료한다고 문구뜨고 좀 좋어졌다 싶었는데 신한 실망이네요,2,2,2018-12-15 15:04:43,3.2.2
b119a638-9c97-4e06-9b4f-e85f6c3f3d20,"랜덤 포인트 혜택이 있지만 왠지 개인정보를 신한 그룹사 전체에 공유하기 위해사 만든 거 같기도 하고... 금융현황을 통합하는 게 무슨 의미인지, 앱의 유용성을 잘 느끼지 못하겠네요",1,0,2024-01-01 04:22:48,
42ec96cb-d5e2-4574-9d50-d9fdfbb43de2,이체할때마다 모바일OTP발급받으랍니다 벌써몇번짼지 짜증납니다,1,1,2024-03-08 11:01:18,4.0.4
a0db10cb-bf28-45b3-8f61-551c4debc2b4,앱이 안들어가거나 로그인해도 버퍼링만 오지게 걸릴때가 많음 진짜 앱 관리 못한다 ㅉ,1,2,2019-04-25 10:37:02,3.3.2
7ecce30d-9e36-4efc-b4e6-9bf801c6664e,V3구동 확인되지 않는다고 신한은행정도 앱이 관리상태가 개판이네 직워 짜르던하고 관리좀해라,1,2,2019-12-28 05:38:21,3.4.5
