date,score,content
2024-01-12 05:03:56,1,앱을 제대로 만들고 설치를 유도하셔야죠!!! 결제하려하면 자꾸 설치해라 업데이트 해라 그러곤 그냥 어플 메인화면으로 넘어가고 결제는 안되고!! 결국 다시 예전 카드앱 깔았네요
2024-01-24 08:28:32,1,동의 받고 시작하는데 클라우드에서 인증서 꺼내서 다 확인했는데 슈퍼 신한만 들어가면 처음 동의부터 시작하네요. 지금 5번째 시도 했는데 힘들어서 사용하고 싶지않네요. 이거 왜이러나요..잘좀만들지.
2023-12-20 06:40:19,1,"사용하던 기기에서 업데이트하고 신분증등록, 계좌인증 까지 했는데 마지막에 ""다른 기기 로그인 안내"" SOL알리미 서비스에 미등록된 휴대폰입니다. 라며 로그인 안됨, 뭐니 이거?"
2024-09-28 07:44:21,5,한눈에 볼수있어 좋네요
2024-02-01 15:08:23,2,금 구매할때 불편하네요 ㅠㅜ 신한앱이 너무 많은데 다 있을필요가 잇나 싶어요. 앱 보기엔 깔끔해 보이는데 굳이 슈퍼솔을 쓸 이유는 글쎄요.. 모르겠어요.
2024-01-10 09:46:14,1,이체시 예전 은행앱에서 설정했던 친구/그룹 은 도대체 어디있는건가요? 아니면 새로 입력하는 방법도 않보이고(이체기록에서 말고..신규로)... 불편합니다.
2024-02-27 07:29:09,1,앱카드 등록하려고 전화인증만 했다하면 앱이 튕겨서 등록은 하나도 안돼고 앱은 꺼지고... 삭제했다다시깔아서도 해보고 광고차단앱 꺼보고도해보고 별짓을 다해도 앱카드 등록이 안되네요 전화인증을 없애든지..
2024-01-06 06:53:00,1,불편함 계좌 이체 여러 사람에게 보낼수도 없음 기존 쏠에서 정보 그대로 넘어오지 않음 여러번의 업뎃이 필요해보임 깔긴 깔았다만 없어지기 전까지는 그 전 쏠을 쓰겠음
2023-12-19 18:48:35,2,토스처럼 하나만 있으면 좋겠다. 신한 포함 앱이 지저분하게 많아 사용감이 떨어진다. 점점 토스로 옮겨가게 된다. 제발 어떻게 좀 해주길.
2024-01-04 14:10:26,3,만보기로 가려면 신한카드로 다시 이동하고 그것도 열리지 않은 채로 계속입니다. 그리고 신한카드와 슈퍼쏠 신한은행 이렇게 세개? 슈퍼쏠로 완전 통합하던가요 불편해요
2024-06-01 15:01:32,1,"진짜 이거 왜 만든건지 모르겠음 물마시기,만보걷기,출석퀴즈 등 왜 옮겼는지도 이해안됨 신한은행 앱으로 잘쓰고 있었는데 굳이 옮겨서 앱깔게 만들고 다시 설정해야하게 만드는 이유가 뭡니까?"
2024-04-28 02:55:17,1,비대면 신분증인증 주민등록증 운전면허증 두가지다 인증이안됨 ..이런형편없는 어플로무슨 2시간이나했는데 .. 이러니 신한은행을 안쓰지 국민들이 이런 사소한부분까지 인증자체가 불가능할정도로 만들어둔걸보니 쓰지말라는거.. 이런 부분을 신한쪽에서 관리를 전혀안하나보군요 하긴 쓰질않으니..
2024-11-06 07:29:20,1,아예 처음부터 안된다하지 왜찍게하냐? ㅋㅋㅋ
2024-10-02 01:04:27,5,왜 해외IP가 차단. 전에는 괜찬아은데 실망입니다
2023-12-29 05:51:42,2,"메뉴, 기능 모두 사용하려면 기존 은행 카드 어플 따로 필요하네요 통합으로 모든 기능 쓸수있는건줄 알았는데 이거 헷갈리게 왜 만든거여.."
2024-04-01 11:49:07,1,"체크카드 결재시 2중 문자 카드 중도상환등 불편한게 한두개가 아닌듯.. 통합도 나쁘지는 않지고 아직 초기버전이라 이해하지만, 아직까지는 없잖은 불편함에 삭제"
2024-01-18 11:57:10,1,계속 오류나면서 가입창으로 이동.. 신분증까지 인증하며 가입하는 앱의 운영이 이정도면 보안도 문제 아닌가 싶네여. 괜히 가입함
2023-12-25 09:54:31,1,"디바이스에서 바이러스가 검출되었다면서 실행이 안되는데, V3 mobile 백신이나 다른 anti virus 돌려봐도 이상이 없답니다. 뭐가 문제인가요"
2023-12-21 01:08:42,2,"업데이트되고나서 쏠알리미에서는 입출금하고 밑에 잔고확인이 되었는데, 현재 슈퍼쏠에서는 입금.출금 금액 확인은되지만 보통예금통장 잔고확인이 안되어 불편합니다."
2024-01-02 03:19:38,1,설치 중 디바이스에서 바이러스 검색되었다고 설치가 안되네요. 백신 프로그램 3개로 검사해도 바이러스 없다고 나오는데...설치 되신 분들은 어찌 되었는지 모르겠어요.
2024-09-11 20:48:50,1,A32 최신버전에서 알림 안와요..
2023-12-20 09:13:45,1,앱을 설치했더니 바바이러스가 검출됐다면서 앱을 이용할수가 없네요... 바이러스 검사도 했는데 문제없다고 나오거든요. 빨리 해결해주세요.
2024-01-23 11:07:17,3,계좌잔액볼때 간편계산기버튼있어서 좋았는데 슈퍼쏠이되고 없어져서 얼마가들어왔고 나왔는지 일일히 확인해야되는 번거로움이 추가됐네요 다시 기능 넣어주세요
2024-01-29 09:37:33,1,도대체 왜 만든거임? 카드와 뱅킹 앱 합칠 목적으로 만든거 아니었어요? 근데 슈퍼솔 앱에는 안되는 기능들이 너무 많아서 정작 쓰지도 않습니다. 이제 곧 지우려구요.
2024-02-15 04:20:50,1,Galaxy Fold에서 가입 중 계좌 본인 확인 후 아무것도 뜨지 않는 현상이 세 번 연속 발생함. 짜증나서 가입할 의지를 잃음.
2023-12-23 10:27:23,1,공인인증서를 이용하지 못하게 되어있네요.ㅠ 폰명의가 다른경우 기존sol에서는 공인인증으로 이용을 잘했는데 슈퍼sol은 본인명의폰으로만 이용가능하게 되어 있군요.ㅠㅠ 기존 sol을 그대로 이용하게 하거나 공인인증서이용해서 이용할수 있도록 해주시길 바랍니다.
2023-12-27 09:30:02,1,"신한은행 정말 낚시 대박 포인트 준다고 해놓고 정작 입력창 안뜸. ※ 단, 앱 가입 절차중 ‘권유직원 입력’ 단계에서 ‘신한카드’ 를 선택해 주세요. (권유직원/지점/코드는 입력하지 않으셔도 됩니다.) 라는거 전혀 안뜸. 그냥 낚시 하고 앱설치 유도 하고 그걸로 다운로드 횟수 카운팅 하고 와 ~ 똑똑하신분들 머리가 ~ 진짜 돈 안쓰고 ~ 홍보허네 ~"
2024-01-27 04:50:27,1,결제시 알림이 너무 늦게 와요. 10분 20분 지나서 올때도 있고 5분 지나 올때도 있고. 딱히 그냥 신한은행 sol bank앱이랑 뭐가 다른지 뭐가 더 좋은지 왜 써야하는지 모르겠어요
2023-12-21 13:18:41,1,솔직히 별한개도 아까움. 서비스차이도 없는데 몆개월동안 홍보니 이벤트 한 이유도 모르겠고 결정적으로 어플 자체가 엄청나게 무거워지고 느림. 신한이 주거래라 쓰긴쓰겠다만 어플좀 제대로 만들어주길...
2023-12-18 01:03:21,1,super sol이니 뭐니 JR맞은 걸로 앱 쳐바꾸더니 평소 잘만보이던 이체 입금내역 확인하는데 500명 대기열까지 쳐들여서 몇십분 대기한다음 쳐봐야되네? 이거 만든놈 안쳐짜르고 뭐하냐 super sol 만든다고 그렇게 요란하게 몇일전부터 홍보 쳐해대더니 앱을 BS같이 쳐만들어놨네. 걍 원래대로 앱 원상복귀해놔라.
2024-01-16 07:07:48,1,무한 본인인증. 두번하다 삭제함. 내 휴대폰인증 계좌인증 신분증인증을 도대체 몇번이나 반복하는건지 모르겠다. 인증 다하면 다시 처음으로 돌아가서 다시 이름넣기부터 시작. 커피 쿠폰하나 받으려고 설치하고 가입하느라 시간낭비한 내가 한심해짐
2024-01-31 14:11:11,2,오류 접수했고 아직은 해결하기 어렵다는 답변을 받았습니다. 그래도 민원처리과정에서 최선을 다해주셔서 업데이트 기다려볼게요.
2024-01-02 05:31:08,4,신한솔페이 사용중에 통합수퍼솔 설치하니 NFC교통카드 기능사용위한 설정이없고 기본앱선택안돼 NFC모바일교통카드가 안됩니다 업데이트시 반영해주세요
2024-01-02 09:09:10,1,괜히 알람도 두번오고 결국 세세한건 전용앱 가야되고 왜 통합한건지 알수가없음 알람 디테일도 입출금 색 표시도 없어지고 덜 직관적
2023-12-23 06:05:20,1,SOL을 사용했던 이유는 입출금 확인이 편리해서 사용했는데 알림도 오지않고 통합적으로 보는것보단 직관적인 어플일때가 편했습니다.
2023-12-26 10:51:24,1,패턴로그인 말고 전처럼 간편비밀번호 로그인 않되나요 패턴으로 하다가 남이 내 패턴 다 보겠네요 지문로그인은 지문등록도 않된다고하고 업데이트 않한게 더 나은듯 전에쓰던게 더 편함
2024-04-28 01:29:28,4,한달애 통장 출금일을 슈퍼쏠에서 바꿀 수는 없나요? 앱이 편하고 이벤트도 많이 해서 좋지만 그거 하나 때문에 신한은행 앱에서 갈아탈 수 없습니다ㅜㅜ
2024-06-03 21:47:24,1,아니 알림센터에서 만보걷기로 한번에 가는 법이 없네 매번 두 번씩 앱 띄워 놓고 해야 페이지로 가고 딥링크 테스트 안하나 진짜 페이에서 만보걷기 가져갔으면 제대로 좀
2024-05-31 04:35:34,1,각각의 앱에서 사용하던 메뉴가 많이 빠져있음.. 그래서 사용 안하게됨
2024-06-30 22:07:37,1,체크카드 사용후 알림올 때 왜 잔액 안보이는 건가요? 슈퍼쏠로 바뀌기 전엔 표시됐는데.. 상당히 불편하네요.
2024-05-19 12:37:18,1,알림음 설정에서 시스템 알림으로 설정 해두면 효과음1 소리로 알림이 뜨는데 언제 업데이트 해주나요?
2024-07-15 03:52:53,1,기존거를 서비스 종료하고 깔게 유도하든가 아닝무슨 한방에 다되는지 알고 기존거 지우거 깔았더니 이건 기존 솔에서 가능합니다 다시까세요 하면 열 안받는 유저가 있나요
2024-05-19 02:34:30,1,이벤트 때문에 깔았더니 해외 거주자는 가입안됨 해외 거주자라도 국내 휴대폰 번호 사용자라면 풀어줘야하는거 아닌가? 해외에서는 신한 고객은 고객이 아닌가?
2024-07-18 02:59:48,1,"통합앱이라고 해놓고 PC로그인 할때 QR로 로그인 하는 기능도 없음(카드, 은행 둘다) 대체 뭐가 통합임? 은행기능에는 이름으로 계좌거래조회하는 기능도 없고... 제일 중요한 기능들은 다 빼놓고 통합이라고? 뭐가 슈퍼야. 나사빠진 앱인데. 다시 은행앱이랑 카드앱으로 갈으타련다"
2024-05-23 13:11:43,1,국세 내려고 계속 찾다가 없는거 보고 현타옴 통합앱이라길래 또 나중에 이걸로 통합하겠지 하고 은행이랑 카드 지웠다가 다시 깔고 이건 지워버림. 통합할라면 제대로 하던가 진짜... 불편하게 뭐하는거지????
2024-06-04 11:15:13,1,통합앱이라고 해서 설치했는데 qr코드 결제 기능이 전혀 되지 않네요. 업데이트 부탁합니다.
2024-05-22 10:30:37,1,만보기 신한카드앱에서는 문제 없었는데 슈퍼솔로 바꾸니까 걸음수 반영이 잘 안됨
2024-01-10 02:19:43,1,"이체내역 어디로 이체했는지 안나오는 것도 별로고, 통합된 슈퍼 쏠이라면서 etf 투자는 쏠에서 해야 하는 것도 짜증나요. 이럴거면 헷갈리게 왜 슈퍼 쏠이라고 깔라고 하는지 모르겠어요"
2024-05-22 11:25:28,1,올라인에서쇼핑할려고했는데 결제하는게왜결제창으로왜안되나요????신한쏠들어가도 결제안되요 왜이런모양 으로만들었나요 결제창으로만들어주세요
2023-12-24 01:31:05,1,준비부족!!! 신분증인식을 몇차례해도 인식 못함. 타은행은 동일한 신분증으로 인식이 잘 되는데 신한SOL은 왜 안되는지. 준비는 잘하고 서비스를 오픈해야 하지 않을까요.
2024-08-05 09:44:04,1,내가 지금까지 써본 금융앱중에 제일 쓰레기 이것저것 다 모아놓았는데 쓰기는 개불편하다
2023-12-29 05:19:12,1,로그인도 못하고있어요. 기존 신한인증서가 있는데 계속 적합한 인증서가 없다고하네요. 저만 겪는 문제 아닌 것 같은데 이거 언제 해결해주나요?
2024-02-26 08:23:15,1,아니 슈퍼쏠로 통합됬다 어쨌다하더니 결제할때는 결국 기존 쏠로 해야해서 다시 깔게하고 인증서관련이나 기타 업무도 다 안되고 슈퍼쏠로 바꿀거면 쓸수있게 좀 해놓고 깔라그래요
2024-01-02 08:19:17,1,"뭐가 이리 많냐.. 신한 솔 솔페이 슈퍼솔 몇개를 깔라는거야. 통합을 하던지.. 나중엔 구형폰은 지원도 안될거고 느려지고, 은행앱때문에 폰 강제로 바꿔야겠네.."
2024-01-02 08:59:39,1,24년부터 혜택 부분만 터치가 안먹음 다른 메뉴는 정상작동을 하는데 이게 안되니 출석체크 등등에 체킹이 안됨
2023-12-26 10:38:54,3,지문인식 시 버그가 있는거 같습니다. 제 폰이 이상한건지 모르겠는데 2회 시도 했는데 안넘어가네요 해결방안 좀 알려주세요. 갤럭시폴드3입니다
2024-07-17 01:46:34,5,한번에 기능을 사용하니 편하네요.
2023-12-27 01:06:44,2,진입 속도 딜레이가 심합니다. + 아직 은행이랑 카드 문자로 받아서 URL 링크 진입 시에 통합이 진행이 안된 걸로 보이네요. 은행이랑 카드 앱 별도로 이용 안 할 수 있도록 해당 앱이 존재하는 게 아닌지? 의아하네요
2024-04-11 16:01:55,1,"너무 절망적입니다. 하루 빨리 청년수당 통장을 개설해야하는데, 신분증 진위여부가 이틀에 걸쳐도 도저히 통과되지 못해 개설하지 못하고 있습니다."
2024-01-19 10:21:47,1,"아무짝에도 쓸모없는 앱입니다. 결국 은행앱, 카드앱 다 필요합니다. 삭제했습니다. 누가 기획한건지...말도 하기 싫네요"
2024-01-05 02:43:15,3,"이거 깔면 다 되는 것도 아니고, 비슷한 기능을 가진 앱을 도대체 몇 개를 설치하라는 건지. 기존의 3개 앱을 그대로 놔둬야 하는 거면 이걸 새로 설치할 이유가 없잖아요. 이게 무슨 낭비인지.."
2024-07-29 12:38:42,5,세심하고도 친근한 내용으로 친화력 짱짱짱이예욥! 망설이지 말고 ~~~~
2024-02-22 05:47:14,3,LG V30 사용중입니다 앱카드 가입 시 ARS 인증 후 앱 복귀 시점에서 앱 응답없음이 떠 가입이 불가능합니다 기존 앱에서는 가입해서 잘 쓰고 있었는데 새 앱에서 안됩니다
2024-06-10 00:50:42,5,"은행 카드 증권 등 한번에 관리하기 쉽고, ui가 편하고 이벤트도 다양해서 좋습니다."
2024-07-02 11:14:53,4,좋은데 신한은행 카드 앱 몇개를 까는지... 이번에도 구어플로 결제가 안되서 깔았음 걍 어플자체를 업그레이드 시켜주세요
2024-06-18 02:22:39,1,카드 등록하라면서 등록하려고 다 입력했더니 카드가 목록에 안 뜸.
2024-08-17 10:42:24,5,매우 편리하고 유용합니다
2024-09-10 07:26:37,1,전번 인증 말고 신한카드로 인증되는것도 있음 좋겠어요 예전처럼
2024-05-22 01:16:35,3,신한은행 신한카드 까지는 그럭저럭 쓸만한데요. 신한증권은 이용하던 기능과 증권계좌에서의 이체기능 등 불편합니다.
2024-10-10 02:56:31,5,소소한 행복♡신한수퍼쏠♡
2024-07-04 03:58:03,1,계좌개설과정 계좌개설신청-인증서설치인증-입력사항모두완료-마지막단계에서 고객님은 장기 미이용고객으로 장기해제 필요하다함.-인증받고 해제완료 전부 초기화됨-계좌개설신청-신분증인증-빛반사 안되게해달라하더니 오늘 신분증인증횟수 초과됐다고 내일하라고함
2024-04-22 04:24:39,1,안 쓰니만 못한 앱. 결국 설치한지 두달만에 다시 카드와 은행 어플 설치합니다. 결제가 안되는데 통합앱이라뇨
2024-03-21 05:51:50,1,자꾸 이거 하라고 이벤트며 뭐 하는데.. 천지인은 이름 입력이 안되서 인증도 못합니다.. 이거 하자고 키보드 바꿔야 하나요... 이벤트를 하려면 제대로 만들어놓고 해야죠..
2024-05-17 07:56:38,1,공초하고 나니까 신분증인식단계에서 진행을 할수가없네? 기존 기기사용못하개게 막아둔겁니까?어플진짜 뭣같이만들어서 귀찮게하네
2024-03-22 06:58:39,1,뭔 다른기기에서 한적도없는데 주기적으로 다른기기에서사용중이네요 회원가입다시쳐하세요 이러고있냐 로그인자체가없는게 제일이상함 뭔할때마다 새로회원가입하라는건 대체 앱을어떻게만들어놓은건지 이해가안됌
2024-01-12 12:33:21,4,sol알리미때도 체크쓸때나 계좌이체후 알림올때 잔액표시가 안되서 지웠섰는데 지금것도 그게 안되서 불편합니다 댓글보고 설정에서 변경하자 신한 뱅크 알림으로 잔액확인이 됩니다
2023-12-27 09:28:28,1,"기존에 사용하던 sol페이, sol뱅크랑 지금 나온 슈퍼sol이 기능적으로, 편의성면으로 대체 무슨 강점이 있는지 도저히 이해을 못하겠음 12/20에 가입한 어플을 27일날 접속하니 다시 가입하라고 뜨는건 덤 ^^"
2024-02-28 16:40:15,1,신한은행 신한카드 기존 그룹사 앱 전부 통합을 해서 기존 그룹사 앱의 모든 서비스 지원 과 앱 무겁고 오류 버그 많은거 개선을 해주시고 기존 신한은행 이메일 문의 기능이 없어 전화만 가능한데 민원 칭찬 불만 질의 제안 슈퍼 쏠 에도 온라인 통합 고객센터 접수후 이메일 회신이 가능하게 추가 해주세요
2024-05-07 13:09:04,1,갑자기 로그인이 풀리며 앱 자체에 접을 할수 없네요 알수 없는 오류라고 뜨고 폰 전원 껐다 키고 앱 삭제후 재설치도 마찬가지네요 모하자는건가요 은행앱에서.... 또한 고객센터로 연락하라고 나와 있는 번호는 시티은행이던데 수정 좀 빨리 해 주세요
2024-04-26 11:11:46,3,통합앱인줄 알고 뱅크지우고 설치했는데 통장사본 출력이 안되서 다시 뱅크앱 설치했네요. 슈퍼솔 장점이 머죠?
2024-03-20 00:48:38,1,전화통화하고 끊으면 신한슈퍼SOL응답없음 팝없이 뜹니다. 관련해서 확인부탁드립니다
2023-12-29 12:13:27,5,카드 은행 페이 등등 다 통합되어 있는거 같은데 기존 뱅크랑 페이앱은 삭제하고 이걸로만 사용해도 되는거 맞나요? 이거 하나로 다 가능항거 같은데.다른 앱들은 왜 그대로 있는건지 햇갈려요
2024-03-20 22:07:45,2,만보걷기 알림이 계속 떠서 너무 화가 납니다. 알림 설정에서 해제도 안돼요. 그거때문에 앱 알림 차단하니 금융거래 알림이 안오네요. 너무 짜증납니다
2024-05-15 23:55:09,1,이건 뭐냐 통학이라고해서 기존 신한카드 앱삭제하고 이앱깔아 사용하니 온라인결제에서 앱설치 되있는데도 앱설치하라고 스토어 연결되고 카드 결제는 안되네 ㅎㅎ 이딴걸 통합 앱이라고 기존꺼 삭제하고 깔라는거임? 앵무새 마냥 복붙 답변말고 확실한 답변을 해달라고요
2024-03-23 11:34:32,1,웹상에서 결재시 앱으로 연결하면 계속 새로 가입하라네요 결재가 안되는 시스템..카드사앱이 결재가 안되면 뭐하라는건지요
2024-03-27 08:16:44,3,정작 필요한기능은 빠지고 구동이 안될때도 있고 급할때 그러니깐 좀 짜증납니다
2024-04-15 03:40:27,1,약관 확대가 안되네요 읽을 수가 없어요 글씨가 너무 작아서 읽을 수 없게 하면서 이해하지 않고 동의 누르면 니책임 이러니까 반감생기네요
2024-03-12 08:23:22,1,전화와서 꼭 쓰고 포인트 받으래서 설치했는데 본인인증만 두번 튕기네요. 별점 낮은 앱은 다 이유가 있나봐요 삭제합니다.
2024-04-23 11:31:12,1,이거봐요. 기존 앱정보로 로그인할수 있게 하세요. 개인정보 바꾸기 싫은거 수정 안하면 사용 못하게 하지말고요.
2024-02-25 09:10:11,3,카드등록하는데 ARS인증할때마다 앱이 멈춰서 작동을 안하네요~ 설치 재설치 반복해도마찬가집니다.
2024-02-10 10:37:22,1,1점도 아까워요 앱 바뀌고나서 결제할때 앱카드 결제요청 누르면 결제창 뜨지도 않고 홈화면 새고해도 안뜨고 뭐 어쩌란건지 모르겠네요
2024-02-21 08:41:00,1,무슨 통합 어플이라더니 은행에서 광고오는 적금삳품보려면 은행어플은 그대로 거기서 사용해야되고 카드는 앱카드또 따로 써야되고 한번에 다 관리되는 것도 아닌데 뭣하러 만들어서 깔게했는지 앱 갯수만 늘리고 짜증
2024-02-20 23:20:52,2,사람들이 이걸로 옮겨서 쓰기를 원하면 기존에 있던 기능을 다 넣어놓고 써달라고 해도 갈까말깐데 이거는 이거로 저거는 저거로 해야돼서 결국 사람들 폰에 깔려있는 거 3개 됐죠? 이걸 굳이 왜 써야하는지 이해가 안가요 삭제합니다
2024-02-25 15:43:08,2,슈퍼쏠로 바꾼지가 한참인데 모바일 쇼핑시 아직도 결제창이 안 넘어가요ㅠ 그것땜에 쏠앱도 다시 설치했네요.
2024-03-20 09:41:30,1,"이걸 왜 통합이라하는지, 쇼핑결제가 되지 않고 계속 에러납니다. 너무 쓸모 없네요."
2024-01-26 15:29:25,1,예전에도 어플 강제 이주시키더니 또 어플을.. 가입하려고 했더니 인증서 발급받게해서 걍 삭제합니다 통합을 시켜서 하나로 빼던가 걍 신한카드 신한은행 탈주하고 싶어요 ㅎㅎㅎ
2024-02-02 13:55:46,1,통합은 좋은데 알림이 너무 늦게 오고 개별적인 기능을 다 담지 못 한거 같습니다
2024-04-03 02:15:59,1,SOL알리미는 간편하게 필요한정보(돈빠져나간거. 잔액얼마남았는지)를 보여줬는데 이 어플은 켜면 슈퍼SOL화면에 왜 켤때마다 비번입력해야됨? 거기다가 은행누르면 매일매일 따로 최신순으로 나와서 짜증날려고함 어플지우고 걍 잔액 SOL로 잔액확인해야겠네요 어플개발자 바뀜? 본인이 편한걸로 어플만듬? 괜히 업데이트했네
2024-01-18 14:26:29,2,패턴 숨기기 기능이 있나요? 있으면 어디에 있는지 처음 들어갈때 패턴으로 했는데 패턴이 다 보여서 패턴 숨기기를 찾았는데 제눈엔 안보이더라구요 있으면 어디에 있는지 확인부탁드려요
2023-12-31 03:38:44,5,본인명의 핸드폰 안쓰는사람이 저뿐인가요?? 금융인증서나 카드인증으로 인증방법을 여러개 할수있게 업데이트 바랍니다 아니면 아이핀등 인증방법이 이렇게도 많은데 굳이 핸드폰인증만 해놓은 이유가 뭡니까 빨리 개선해서 업데이트 합시다
2024-05-07 22:29:44,1,기동전문 오류가 발생하였습니다 뜨고 안 들어가집니다. 재설치해도 그렇네요. 뭔 어플만 잔뜩 만드셨어요?
2023-12-29 06:53:47,1,잔액 표시 좀 빨리 해주세요.. 그거 안 보이니까 너무 불편해요.. 아니면 이전 버전으로 어떻게 돌립니까?? 알리미 잘 쓰고 있었는데 왜 이렇게 변한거죠??
2023-12-28 23:55:12,4,슈퍼쏠 설치 하고 사용하니 아직 개선점이 있네요 통장잔액보이기 설정등이 없어서 아직은불편하네요
2024-01-26 07:03:13,1,신한은행 앱이 통합되었다고 해서 설치하고 예전 신한은행 앱을 지웠는데 실수했네요 청년도약계좌라던가 뭐 신청만 하려고 하면 옛날 앱을 쓰라고 하면서 통합은 왜 한거죠?
2024-05-17 11:22:33,1,인증뮨자 하루종일 안 오고.어플 쓸 때마다 슈퍼 쏠로 바꾸세요 이러고 앉았네 화딱지나서 못쓰겠다 어플 검색창에 신한 검색하면 어플 세 개 뜨고 아오
2024-02-06 13:21:05,1,꾸역꾸역 작년쯤에 미성년 신한쏠 로그인하고 신한플러스도 쓸 수 있었는데 신한플러서가 이 어플로 바뀌면서 못 쓰는거면 줬다 뺏기아닙니까?
2023-12-21 02:05:55,2,"적응할만 하면~~ 앱을 바꾸고, 앱이 정신이 없어서, 개발자와 담당자님들 보라고 일부러 리뷰 남깁니다. 신한은행 오랜 고객이고, 신한카드도 잘 쓰고 있는데, 어플 만큼은 정말... 한숨 나옵니다... 너무 정신없어요... ㅜㅜ"
2024-01-08 06:12:42,1,이거 나왔길래 깔아서 몇개 보니깐 있을건 다 있는거 같아서 은행앱 카드앱 다지웠더만... 필요한게 조금씩 없어서 다시 다 깔게 만드네...
2024-01-29 07:06:25,1,카드결제 후 10분 이상 지난 다음 푸쉬알람이 오네요...시간 차 푸쉬알람으로 결제가 잘못되었는지 계속 확인하게됩니다..ㅡㅡ 그리고 신한 슈퍼sol은 왜 만들었는지...의도를 잘 모르겠어요
2024-01-09 13:33:50,1,인증서를 매일 재발급 받으라고 함. 한번 재발급 받았으면 됐지 뭘 하루 지나면 또 재발급을 받으라는건지
2024-01-01 05:30:41,1,"중복에 오류에 짜증나네요 슈퍼쏠, 은행, 증권, 카드, 페이 모두 따로 앱이고 뭐 하나 하려면 어디로 이동한다고 뜨고 뭐하자는 건지 신한은 그냥 앱 개발하지 마세요"
2024-01-12 13:21:13,1,최악 잘쓰고 있는 앱 자동으로 업뎃 되고 노인네들 적응 하기 힘드네.
2023-12-23 04:02:19,1,"세상 불편하네요. 기존 쏠 페이 신한카드는 입장하자마자 즉시결제, 이용내역 한번에 보이는데 이건 뭐 일일이 찾아들어가야하고 ㅡㅡ 개불편해서 삭제함. 기존에 쓰시던분들도 걍 다운받지 마시길"
