date,score,content
2024-07-15 14:39:17,3,"신한쏠페이, 신한쏠카드, 신한쏠뱅크 이젠 신한슈퍼쏠ㅡㅡ 뭔 이리 앱이 많습니까?? 슈퍼쏠 하나로 만들었음 나머지 막고 여기로 이동하게 만들든가 해야지 복잡시러 죽겠습니다. 나원참 이 앱도 오늘 알았음"
2024-07-11 13:37:24,1,광고 클릭하게 유도하려고 물마시기 확인란에 교묘하게 위치시키네요 심지어 광고 누르면 무한 로딩이라 뒤로가기도 안먹힘 최악입니다
2024-07-12 01:09:39,3,만보기나 물마시기를 누르면 하얀 바탕만 나오고 작동하지 않습니다. 이와 관련한 정보를 어디서 얻어야 할지 모르겠습니다.
2024-06-18 05:20:11,1,주민등록증 인증 정확하게 했는데 일치 하지 않다. 뭐다 뜨네요.. 안된다. 일치하지않다. 못한다. 등 불편해요.
2024-06-25 02:29:42,1,저번달인가 설치예약 및 설치시 5천포인트 준다고 전화와서 설치했는데 포인트 주지 않네요. 이벤트가 없었나봐요.
2024-07-20 04:18:08,4,다양한 상품정보도 받고 포인트 적립도 되는 일석이조의 상품등이 다양하게 활용할수있어서 좋다.
2024-06-11 05:03:40,1,프리미엄쿠폰 어떻게사용하는 거예요? 쿠폰받으면 매번 사용완료가 되어있음 놀리는것도 아니고그리고 앱을 하나로 통합하시던지 은행이랑 두개나깔고 오류가 넘 잦아요
2024-05-29 02:49:47,1,"통합은 시킨거 맞나요? 기존 기능 쓰려면 각기 다른 앱 설치하라하고, 심지어 데이터건, 와이파이건 연결이 되던 안되건 모든 기능이 멈추는 현상은 계속나타나네요"
2023-12-21 10:14:32,1,슈퍼솔로 신한인증서를 필수로 쓰게끔 만든건 좀 아니지 않나요? 두 개 이상 은행 앱 써서 공동인증서 하나로 은행업무 하는 사람도 있는데요? 인증서 또 깔라고요? 전 그냥 입출금 알림 간단한 카드사용내역 보고 싶은 겁니다. 괜히 업그레이드 눌렀네 ㅠ 원래 알리미 다시 다운받을 수 있는 방법좀 알려 주세요
2024-05-03 07:23:06,3,"통장사본 이미지 다운받으려했는데 전에 해봤었는데 아무리 찾아도 안보여서 고객센터 전화해봤어요. 근데 신한 슈퍼sol 통합된 어플에서는 불가하고, 이미 삭제했었는데 신한sol뱅크 어플에서만 통장사본 다운 가능하다네요ㅠㅠ 다시 다운받아야되;;;;;ㅠㅠ!!!!"
2024-05-09 00:02:00,1,"지웠습니다. 20년 넘게 신한쓰고있는데 기존 카드앱과 은행앱 두개만 있어도 별로 불편하지않네요. 그리고 앱설치시 커피쿠폰 유도하시던데, 설치시 뭘 체크안했다고 주지도 않더군요. 보통 선택사항 동의안하는 편인데, 이런식의 광고성앱을 만드실거 기존앱 유지에 더욱 힘써주세요."
2024-11-06 10:21:50,1,아 미치겟네 라방 방송시간도 아닌데 알람이 왜계속울림 욕나오네 진짜 조취좀해봐요 5분에 3번이상울리는중인데 개스트레스받네
2023-12-26 22:46:28,1,"신한쏠에서 공인인증서 못 불러오는 상황은 신한에서 해결해야할 문제임. 새로인증서 발급받으라는데, 신한은행에서 발급받은 인증서 타은행에 다 등록해서 쓰는 나는 수십번을 재등록해야하는 번거로움때문에 못 쓰겠음. 이름 주민번호 물어보고 휴대폰본인인증까지 하고도 로그인 하려면 인증서가 꼭 필요한건지 묻고 싶다. 로그임 한번 못 해보고 제거될 앱임."
2023-12-29 00:49:45,1,예전 앱 들어갈 때 간편비밀번호로 들어갔었는데 이제는 로그인 방법이 패턴과 지문 뿐인게 넘 불편해요 그리고 전에는 들어가자마자 한 화면에 전체계좌 입출금 내역이 다 나왔는데 지금은 계좌가 떠서 들어가서 확인하는 거 너무 불편해요 전에께 편해요. 다시 예전처럼 해주세요
2024-06-21 01:44:43,5,정보지식도 얻고 재미있는 퀴즈도 풀고 포인트도 적립하고 넘 좋아요.😃
2024-01-11 05:38:20,1,신한앱(은행/카드)을 강제종료하면 폰은 껐다가 켠 것처럼 빨라져요 달리 말하면 신한앱을 실행하기만 하면 폰이 느려져서 사용하기 불편해져요 실행코드 sleep을 UI Task에 넣지 마세요
2024-06-05 01:17:30,1,"앱을 열면 첫 창이 홈으로 떠야 하는데 알림 창으로 뜸. 그래서 죄측 상단에 있는 뒤로가기 화살표를 누르면 앱이 종료 되는 신기한 앱 너무 불편합니다. 차라리 기존 앱을 업데이트 하던가, 증권사랑 합치지......^^ 효율은 정말 한 꼬집 만큼도 없습니다."
2024-01-30 10:13:14,1,이거 하나면 다 되는줄알고 다른 어플 삭제했는데 앱페이 결제 시 신한솔 선택하니까 냅다 메인페이지만 나오고 결제를 어떻게 하라는건지 모르겠네요. 결제까지 이어지지가 않아요. 구 신한페이인가 그거 선택하니까 예전 신한페이 다시 설치하라는데 뭐가 맞는건가요
2024-04-02 12:25:26,1,신한은행/신한카드 단독 어플은 잘만 열리는데 이 어플만 초창기(통합앱/처음 나왔을때)처럼 또~ 버퍼링 로딩만 하염없이 되고 다음 창으로 넘어가지도 않고 뭐가 잘못 된걸까요? 찌증 ㅠ ㆍㅠ ~개선좀 해주세요.
2024-06-07 14:54:43,1,"내가 가입한 상품의 상세 정보와, 현재 내 상태를 비교할 수 없다. 예를 들어 내 적금 계좌 탭에서 해당 적금의 우대 조건이 어떤 것이고 내가 충족한 것이 무엇이고 미충족한 것이 무엇인지 단번에 확인할 수 없어서 속 터진다."
2024-06-11 05:59:07,2,통합앱을 만들거면 제대로 만드세요. 인증서기능도 기존 쏠에서 써야하고 땡겨요 쿠폰도 기존 쏠에서 다운받으면 이게 무슨 통합인가요? 여러앱 안쓰게 만들려고 하는 좋은 의도로 만드는게 통합앱인데 이건 받아야 할 앱을 하나 더 늘린 꼴 밖에되지 않습니다.
2024-06-05 01:57:55,1,"멀쩡하게 잘되는 앱 뭐하러 두개로 나누는지.... 참 쓸데없는짓 하네, 할려면 기능 통합해서 새걸로 바꿔야지.. 이 불편하게 뭐하는짓인가...... 오류라도 없으면 다행이지... ㅋㅋㅋ 심심하면 먹통 이것땜에 카드도 바꿀까 고민되네"
2024-05-19 13:17:09,2,"신한 은행, 카드 어플의 기능을 100% 제공하지는 않습니다. 한달애(愛) 적금은 입금만 가능하고 출금이 불가능해서 은행 어플도 사용해야 함. 하나로 완전히 통합해서 쓸 수 있으면 폰 용량 아끼고 참 좋을텐데."
2024-06-01 10:31:25,4,다른건 불편한게 딱히 없는데 cgv 결제창에서 구sol페이 로는 결제가 잘되지만 슈퍼sol결제를 누르면 이미 사용중인 앱이고 설치가 되어있는데도 계속 스토어로 연결합니다... 그리고 결제가 안되죠... 좀 고쳐주시면 감사하겠습니다
2024-05-19 13:35:49,1,신한솔 가입하려는데 폰번호가 다르다며 신한뱅크까지 얼렁뚱땅 가입시키려는 수작인가요? 저뿐아니라 지인도 같은 현상을 겪네요? 신한뱅크 가입한적도 없고 폰번호는 10년넘게 그대로이고 신한카드는 사용한지3년정도인데 무슨폰번호가 바꼈다는걸까요?ㅋ심지어 폰번호 인증하려면 뱅크가입하고 화상통화까지 강제로해야 시스템 무슨 ㅋ 공산당이십니까?
2023-12-17 23:54:55,3,"오늘 신한 슈퍼Sol로 바뀌었는데.. 7시에 오픈될때는 정상적으로 되었지만, 지금 현재는 로딩이 길어지고 정상적으로 안됩니다. 예전에도 신한Sol어플이 바뀔때도 그런적있었는데요.. 앱이 바뀔때마다.. 로딩만 되고 잘 안되는부분 고쳐야겠네요."
2023-12-22 13:02:00,1,통신사 선택이 맞는데 '통신사고객정보불일치' 오류 떠서 가입 자체가 안 됩니다. 모든 통신사 눌러봐도 동일 오류.. 기종은 노트20입니다. 테스트 많이 해보고 오픈하는 게 어땠을까요?
2024-11-05 02:10:40,1,홈에서 서비스 눌렀을 때 하얗게 무한로딩 되는 현상 도대체 언제고침?
2024-11-06 08:17:09,1,#쫌 읽고 답변을 해라! 메일 보내도 답변이 없으면 이거 읽고라도 개선의 의지를 보이던지 좀 합시다....! 알림음 설정 변경해 놓으면 다시 앱에서 제공되는 소리로 변경 안되게 못하냐?????????????????????????????????????????
2024-01-10 01:56:05,1,"아,,,,,진심 어플도 개빡치게 만들어놨네,,,, 몇번을 지우고 다시 받아도 똑같고,,바이러스가 검출되었으면 종료될게 아니라 무슨 방법이라도 있어야 되는데 이건 뭐 그런것도 아니고,,,어휴,,,ㅁ 그냥 차라리 이전에 쓰던걸 다시 쓰는게 훨씬 낫겠다,,,"
2023-12-23 06:49:09,1,"기존 Sol알리미는 어느 시간에, 얼만큼의 금액을 사용했는지와 어느 계좌에서 사용되었는지 혹은 이체했었는지, 남은 금액은 얼마인지를 한눈에 보여주어서 가계부 사용시에도 매우 유용하게 사용했는데 업데이트 이후 그런 장점들이 모두 사라져 너무 불편하네요 계좌에서 얼마 사용했는지를 계좌조회로 클릭하고 다른 계좌에서 사용한 금액확인을 위해 다시 뒤로가기이후 계좌클릭을 해야하고.. 굳이 장점 없애면서까지 이렇게 만든이유가 있나하는 아쉬움이 크네요"
2024-05-14 01:57:33,3,슈퍼SOL 깔으라고 하도 그래서 깔았는데ㅜ 공동인증서 PC로 내보내기 기능은 또 그냥 SOL에만 있나보죠... 통합형으로 모든 기능 다 되는줄 알았더니 다른 것들도 기능 안 보이는거 걍 참고 썼는데 불편하네요 실제로 슈퍼SOL로 옮기고 어플 접속횟수가 줄었어요
2023-12-20 13:17:45,1,어플 사용하려고 하니까 바이러스가 1개 검출되었다면서 강제종료 되네요. 다른 어플에선(신한 다른 어플 포함) 이런적이 한번도 없었는데 말이죠. 거기다 무슨 바이러스인지도 안알려주고 처치도 안해주고 강제 종료만 시키니까 뭐 어쩌라는건지 알 수가 없네요
2024-11-13 11:01:12,5,우선 포인트도 쏠쏠~하고 다양한 정보도 가득이네요...
2024-06-24 20:47:37,4,아주좋아요 소비자에게 적극적으로다가오는 모습도 좋구요 매우 편리해서 좋읍니다
2024-01-16 14:58:33,1,쇼핑몰을 모아놓고 쇼핑몰로 인도하는 그런 어플같음. 광고 또는 앱 자체를 보면 마치 저 앱 하나로 다 해결되는거 같지만 결국은 sol뱅크 sol페이 sol증권으로 어플을 다시 켜야함. 그런데 막상 해당어플에선 슈퍼sol 어플을 깔아야만 기능이 작동하게 만듦 ㅋㅋㅋㅋㅋ무쓸모인 앱....
2023-12-29 11:19:53,1,메뉴 사용이 너무 불편합니다 직관적이지가 않아요 지워야 될 정도 입니다 신한 play 너무 잘 썼는데. 업데이트 하고 너무 불편해요 사용자 편의를 생각하지 않은 UI입니다
2024-04-04 03:56:44,1,"신한카드앱 잘 사용하고 있었는데, 갑자기 통합 개판치더니 기존 신한카드앱에서 앱카드 초기화 되어 있네요. 다시 카드 등록 인증 하라고요? 아무런 안내도 없이 이게 뭡니까. 기존 신한앱카드 정보 초기화 짜증 나지만, 신한 슈퍼SOL 앱카드 등록 후 결제하니 ""신한 슈퍼SOL에서 이용할 수 없는 코드입니다."" 참 가지가지 한다. 초기화 된 신한카드 앱에 다시 카드 등록하고 진행 하겠음! 이 앱의 존재이유는 뭡니까???"
2024-06-01 15:32:52,1,이거 왜 만들었어요? 도대체 신한은행 어플은 몇개를 써야되나요? 기존꺼에서 업데이트하면 안되나요? 왜이렇게 어플을 새로 만들어서 고객들 머리아프게 하시나요? 쏠야구 관련만해도 솔뱅크는되고 슈퍼솔은 안되는게 있고~~ 6월부터 포인트 받는게 몇가지 안되는게있어서 버티다가 설치하긴했는데 모든 기능을 다 가져온것도 아니라서 두개 다 써야되니까 너무 불편하고 짜증납니다.
2024-05-10 06:23:40,1,어제까지 쏠뱅크 앱에서 슈퍼쏠 들어가서 만보걷기 사용하다가 슈퍼쏠로 전환하면 1000포인트 준다고해서 전환하기 눌렀더니 걸음수가 안뜨고 걸음수 확인하기 누르면 슈퍼쏠 설치하기가 뜨네요.포인트 안받고 전환 안하고싶어요
2024-07-16 07:25:25,1,자꾸 보안키패드를 준비하지 못했다고 알람창이 뜨면서 로그인을 못해요 며칠째 앱사용을 못하고있어요
2023-12-23 07:02:51,1,"엉망인 상태, 매일 재가입 해야됨, 모바일 otp 인증이 웹과 연결 안됨. 이체를 모바일에서 하려고 보니 기존 앱의 즐겨찾는 계좌정보가 연결 안된다는 사실. 그래서 그 많은 계좌번호를 다시 찾아야됨. 당분간 깔지 마시고 기존 것 이용하세요. 관계자분들 일 좀 하세요."
2024-06-29 00:09:28,3,접속시 불편(인증확인)함~재등록시 역시 복잡(본인확인시 패스)함 개선요망
2024-07-10 05:51:41,1,통합앱이라고 되어있지만 각자 앱으로만 가능한 것도 있어서 하나로 해결이 안됨
2024-07-31 12:08:35,1,"앱이 깔리지 않습니다 계속 기다리다 짜증이나 리뷰 올립니다. 몇분째 기다렸고 취소도 안되는데, 보니 제 폰 문제도 아닙니다. 앱이 왜 안 깔리는지 이유라도 알았으면 좋겠네요"
2024-04-15 01:42:06,3,"모든거 통합기능이면 솔페이 pc결제도 가능하게 되어야하는 것 같습니다. 증권사앱은 제외하더라도 super sol로 만들었으면 신한은행, 카드, 페이앱은 통합되어 이 어플에서 다 쓸수있어야하지읺을까요? 결국 모든 어플을 깔게되니 너무 불쾌합니다..."
2024-06-17 13:03:54,1,계좌이체시 추가이체 기능은 왜 없앤겁니까 어플 기능이 과거형보다 못하네요 이럴거면 왜 만든건가요?
2024-01-05 02:37:56,1,신한은행앱 잘 쓰고 있었는데 이 앱 시작하니까 갑자기 신한 인증서 새로 발급해야한다고 해서 발급했더니 다시 실행할때 이번에는 휴대폰이 다르다면서 또 발급시킴 ㅡㅡ 발급 후에 신한은행앱을 실행하니까 인증서가 다르다고 또 발급시키길래 짜증나서 꺼버렸네요. 앱마다 인증서 따로 쓰나요?
2024-09-03 01:02:16,1,통합이라고 하면서도 은행 중 중요업무는 결국 기존 신한은행 앱을 이용할 수밖에 없게 만들고 두 프로그램 사이의 충돌로 결국 슈퍼솔을 사용할 수 없게 만들고; 어설픈 통합은 오히려 독입니다.
2024-07-14 21:48:16,5,재미도 있고 한눈에 여러 정보를 한꺼번에 조회 가능하니 실용적...
2024-05-30 00:38:54,1,앱이 하루에도 몇번씩 죽어요. 사용중이 아닐 때 도 뜬금없이 수시로 죽는데 백그라운드에서 죽는 거 좀 안정화 해주세요. 죽어 나가는 이력 엄청 쌓이고 있을텐데 대응 안하나요?
2024-01-17 08:06:12,1,"4일간 가입한 회원에게 쿠폰이랑 신한포인트 선물지급 한다고해서 바쁜시간 쪼개 설치하고 가입진행하려했드만 계속 신한인증서만을 요구하네요. 난 아직 구 공동인증서만 쓰는데, 왜 신한인증서만 강요하는지? 황당해서 가입진행을 중단하고 슈퍼sol 어플은 다시 삭제합니다. 신한인증서 없으면 어플자체를 쓰지도 못하게 해놨군요? .. 못쓰게 하면 안써야겠네요..;; 열심히 홍보하세요~"
2024-02-12 07:46:54,1,앱카드 등록을 할 수가 없습니다. 다른 앱은 안 이러던데 이 앱은 앱카드 등록을 위해 인증 전화 연결이 되면 강제 종료됩니다... 앱카드 등록이 안 돼서 그냥 카드 정보 치고 ars 전화를 받아서 결제를 하는데 그 과정에서도 앱이 갑자기 종료됩니다 오류도 많고 앱이 불안정합니다
2024-01-23 06:59:48,1,그냥 기본 신한이랑 차이점이라면 기본 앱은 계좌관리가 중점이면 Sol은 입출금을 실시간 알림으로 알 수 있고 내부 계산기도 있고 가시성도 좋은데 바뀐 이후론 그냥 신한앱이랑 이거랑 차이가 뭔지 모르겠음 그냥 단순 입출금 관리만 신경쓰면 됬던게 너무 복잡해졌고 기본 신한앱도 sol인데 이거나 그거나 차이를 모르겠음.
2024-01-16 04:02:06,1,적금가입시 설명서 확대도 안되서 읽을수도 없는데 뭐하러 넣어놓은건지?? 읽을수도 없는데 동의는 하라그러고. 신한쏠에서 하던걸 고대로 가져왔네? 읽을수 없게 만들거면 넣지를 말아요. 넣을거면 읽을수 있게하던가. 형식적으로 동의받으려 하지말고 읽을수 있게하는게 그리 어려워요???
2024-01-29 00:45:01,1,출시당시에는 폰이 오래되서 안되었는데 s24바꾸고 설치후 홈앤쇼핑에서 결제를하는데 어플 연결이 안됩니다 배민에서도 어쩔땐 되고 어쩔땐 안되고 그래요 기존 신한 sol 은 잘되네요..결국 구)신한 sol 재설치 했습니다 처음엔 휴대폰 방화벽이나 보안문제인줄 알았습니다 앱 정비 하셔야겠습니다
2024-03-28 11:00:19,1,진짜 속터지네요 ARS인증 다 하고 카드 등록까지 했는데 다시 로그인하라고 무한반복 ㅡ ㅡ 앱도 잘 안열리고 속터집니다 기존 솔 잘쓰고 있었는데 이거 깔으라고해서 잘쓰던것도 지웠더니 둘 다 로그인 안되서 돌아버려요 진짜 앱을 이따위로 만들어놔서 진짜 갑자기 카드내역 입출금내역 알림도 못받고 결제도 못하고 어쩌라는거냐고 대체
2024-04-21 02:03:37,3,통합된건 좋은데요. 아래 내용 반영해주세요. 1. 계좌이체쪽에서 자주쓰는계좌 기능이 없어졌어요. 이체할때는 이전버전 쓰고 있어요 2. 카드쪽에선 이번달에 사용한 금액은 나오는데 이번달 결제예정 금액 조회가 안됩니다. 솔페이에는 둘다 나와요
2024-03-25 05:42:21,3,"기존 신한솔뱅크 어플처럼 입출금 내역별로 메모 작성할 수 있는 기능은 없는건가요? 메모기능을 항상 사용했는데, 슈퍼솔로 바꾸고 나서는 메모기능 사용을 못하고있어 불편하네요. 메모 기능있다면 안내 부탁드립니다."
2024-01-02 00:46:01,2,"쏠뱅크, 쏠페이, 쏠라이프, 쏠비즈, 신한증권, 프리미엄쿠폰 등 신한은행 그룹 관련 앱만 6개나 깔았는데 이걸 또 깔아야되는 이유를 모르겠네요. 기존 앱에 익숙해질라하면 업데이트란 미명하에 계속 UI가 바뀌어 불편하게하더니 슈퍼쏠은 계속 쏠뱅크와 쏠페이를 왔다갔다 해야해서 더 불편합니다. 은행 관계자들도 직접 사용 해보고 고객 입장에서 개발 좀 합시다."
2024-03-07 05:48:14,3,이거 설치 유도하는 이유가 뭔가요? 어차피 각 해당 기능 이용하려면 신한뱅크 신한카드 다 설치해서 들어가야되는데 귀찮아요. 한 어플 내에서 다 해결되는 것도 아니고 까는건 여러개 기능은 다 제 각각ㅠㅠ
2024-01-04 13:16:47,1,"신한은행 그전 알리미앱이 더 좋았습니다 간단하게 입출금 및 카드결제 확인 되던걸 아예 싹 뒤엎어 놓고는 사용하기 힘들게 해놨네요 사용하면 할수록 이 앱 출시한 신한에 대해 뭘 위해서 만들었는지 묻고 싶습니다 만들어서 출시할거면 제대로 만들어 출시하시지 기존앱들에서 유용하게 쓰던 기능들은 다 없애고 정보확인 못하게 막아놓은거 같습니다 한마디로 개판입니다 욕밖에 안나옵니다 그리고 업뎃하고 기존 알리미 기능만 쓰겠다고하니 거래=> 전체 나, 거래=> 은행 정보는 뜨면서, 거래=> 카드 드가면 왜 정보가 뜨지도 않고 (받은 알림이 없어요 )만 뜨고!! 머 이런 정신나간앱 만들시간에 원래 s 알리미 앱 돌려놔요 역겨우니까"
2024-03-09 16:09:57,1,너무 불편함 신한카드앱 대체 왜 없앴나요? 할부결제한거 일부선결제 해야하는데 대체 그항목은 어딜가야 찾을 수 있는거냐구요 고객센터 문의없이 바로 찾을 수 있는 항목이어야 하는거 아닌가요? 은행 카드 묶어서 만든거 솔직히 왜 그랬는지 모르겠고... 암튼 너무너무 불편하고 쓸데없는거같네요...
2024-02-24 10:16:15,1,"""신한인증서 상태가 확이되지않아..."" 몇변이나 재설치해도 이 문구만 뜨고 로그인도 안되고 더 이상 진행이 안되네요. 기종은 갤럭시S22울트라입니다. 해결 부탁드립니다. 쫌!!"
2024-05-07 01:50:07,1,갤 플립5에서 앱카드 등록할려고 하는데 ARS 인증만 8번이나 하다 포기. ARS 에서는 인증 됐다는데 표시되는건 인증 안됐다고 무한반복. 앱을 어떻만든거냐. 이전휴대폰에서는 됐는데..
2024-01-10 22:43:47,1,"(추가리뷰) 가입어려움. 해외에 체류중입니다.가입 시 해외IP접속으로 회원가입이 어렵습니다. 가입 요청드립니다. 가입어려움. 기존 신한플러스는 신한은행 및 신한증권 가입 전화번호(법인 번호 및 타인 번호)로 가능했는데, 현재는 본인(개인)명의 전화번호로만 가입 가능하네요. 어느 부서에 연락해야 이 문제를 공유할수 있을까요? 아님 연락처(전화번호, 이멜, 웹페이지, 챗봇 등등) 부탁드립니다."
2023-12-25 13:52:54,1,"기존 솔알리미의 알림으로 거래내용이랑 잔액이 한번에 보이는 간편함은 어디갔나요? 솔알리미의 가장 큰 메리트였다고 생각하는데 지금은 입출금만 덜렁 보이고, 어플 들어가서 확인하려면 자동로그인도 안돼, 들어가서 거래내역을 눌러서 봐야해, 진짜 하나하나 쓸때마다 화가난다"
2024-04-01 03:26:12,1,"솔직히 왜 만들었는지 모르겠음,,,통합이라고 하지만 여전히 일부 기능들은 카드앱 또는 뱅크앱으로만 가능 그냥 어플 하나 더 생긴느낌 제발 통합이면 통합답게 한 앱으로 가능했으면..."
2023-12-25 22:13:05,1,삭제 후 재설치 하면 꼭 회원가입 화면만 나오는데 기존 가입했는데 왜 꼭 회원가입을 다시해야하나요. 심지어 설치한 첫날엔 같은 폰인데 설치하고 가입하고 30분 뒤 재로그인하니 같은 기기 아니라고 회원가입하라고 하더니만.. 로그인한번하려면 본인인증만 계속 시키는 앱.
2024-02-13 23:23:20,1,관련앱 변경 자체가 엉망이지만 그것과 별개로 최악입니다 삼성폰 사용중이고 이 앱 오류라고 계속 뜹니다 배터리 잡아먹는 것 경고 뜨고요 그냥 이쪽 앱 중에서도 단연 최악인 듯
2024-01-18 09:56:16,2,이거 결제할때 연동이 왜 안되나요? 홈플에서 결제할때 슈퍼솔로 하는데 메인메뉴에서 아무반응도 없네요? 그래서 솔페이로 했더니 결제할카드 나오고 잘되던데요... 솔페이보다 슈퍼솔이 더 잘되야하는거 아닌가요? 먼가 불편합니다.
2023-12-30 13:17:19,1,"역대급 앱이라고 해서 신한쏠과 신한플레이앱을 통합하는 줄 알았는데 걷기는 신한쏠로 이동, 앱카드는 신한플레이,,, 쓸데없이 비슷한 앱만 하나 더 만들어놓고 딱히 차별점이나 유용성을 못 찾겠다"
2023-12-20 03:15:21,1,슈퍼가 아닌 앱이 더답답하게 더욱더 느려지고 화면이 불안정해지고 화면도 자꾸 멈춰 지고 불편해서 기다리기지처서 피곤하고 낮아지는 포인트 점수와 광고가 많아서 개선이 전혀 않되고 서비스 문제 심각합니다
2023-12-17 23:07:26,1,여태 잘 사용했는데 기존폰이 아니라고 기존폰 차단 후 한개 디바이스에서만 사용하게 하겠다 하는데 한개만 쓰고있고 그 폰에서 새로 사용하는건데 이럴 땐 어떻게 해야하나요? 기존 걸 차단하면 지금 폰을 차단한다는건데 그럼 새로 다시 다ㅡ 설정해야한다는건지요?
2024-04-19 05:09:02,1,"왜 입출금 알림음을 내가 만든 음으로 변경을 해 놓아도 다시 원래 앱에서 제공되는 소리로 계속 변경이 되는걸까요?? 수정 해주시죠!! p.s 며칠 뒤 또, 또, 계속 변경 됨!!! 수정 안할꺼임????? _아직도 똑같은 증상!!! 답변 좀 주시죠. 24년04월07일_안보는거임?? 메일로 보내도 미응답!! 24년04월19일_아직도 수정 안함"
2024-04-16 03:30:13,1,슈퍼쏠 이벤트를 그렇게 계속 할꺼면 여러사람이 할수 있게끔 하셔야죠 핸드폰 명의가 다른사람이 얼마나 만은데 어플을 핸드폰명의로밖에 가입이 안되게 하시면 어떻게요 거기다 포인트를 열심히 모으고 있었는데 이제 강제로 어플받게 하고 못받으면 포인트도 못받게 하고 이게 이벤트인가요?
2024-02-07 07:50:48,3,여러 변화를 주려는 시도는 좋으나 고객 입장에서 큰 장점을 못 느끼겠습니다. 특히 계좌 입출금 내역에서 클릭하여 메모할 수 있는 기능이 없어졌는데 추가해주셨으면 좋겠습니다.
2024-01-20 00:58:15,2,광고는 모든걸 다 할 수 있는 단 하나의 슈퍼앱! 현실은 다른 앱으로 링크 태워서 보내주는거 뿐이라 결국 다 깔아야됨...ㅎ 깔고 만포인트 받아서 별 하나 더 드립니다
